"","Month","LongDes","TotItemQty","Brand"
"3215",8,"BREYERS FAT FREE CRMY VAN",32,"OTHER"
"3216",8,"BREYERS LACTOSE FREE VAN",78,"OTHER"
"3217",8,"BREYERS NAT ROCKY ROAD",53,"OTHER"
"3218",8,"BREYERS NAT STRAWBERRY",50,"OTHER"
"3219",8,"BREYERS NSA VANILLA",65,"OTHER"
"3220",8,"BREYERS NTRL CHOC",78,"OTHER"
"3221",8,"BREYERS SNICKERS IC CRM",89,"OTHER"
"3222",8,"BRYER SMRT CARB VAN I/C",52,"OTHER"
"3223",8,"BRYERS OREO CHOC CKIE&CRM",48,"OTHER"
"3224",8,"BRYRS CRBSMRT ALMD I/C BAR",71,"OTHER"
"3225",8,"BRYRS TIRAMISU GELATO",48,"OTHER"
"3226",8,"BRYRS TRPL CHOC GELATO",38,"OTHER"
"3227",8,"BRYRS VAN CRML GELATO",108,"OTHER"
"3228",8,"CADBURY CARAMELLO RF IC BAR",14,"OTHER"
"3229",8,"CADBURY CHOC ALMD RF IC BAR",10,"OTHER"
"3230",8,"CHRSTMS MLK ICE CRM EGGNG",19,"OTHER"
"3231",8,"CIAO BELLA KEY LIME GRHM GEL SQ",18,"OTHER"
"3232",8,"CLEMMYS IC CHOC CHIP",5,"OTHER"
"3233",8,"CLEMMYS IC CHOCOLATE",8,"OTHER"
"3234",8,"CLEMMYS IC COFFEE",5,"OTHER"
"3235",8,"CLEMMYS IC TSTD ALMOND",6,"OTHER"
"3236",8,"CLEMMYS IC VANILLA BEAN",4,"OTHER"
"3237",8,"COOLHAUS IC SNDWCH CHOC",14,"OTHER"
"3238",8,"COOLHAUS IC SNDWCH PNTBTR",11,"OTHER"
"3239",8,"COOLHAUS ICE CRM 3-BAR CH",8,"OTHER"
"3240",8,"COOLHAUS ICE CRM 3-BAR M CH",8,"OTHER"
"3241",8,"COOLHAUS ICE CRM BANA FSTR",11,"OTHER"
"3242",8,"COOLHAUS ICE CRM BLSMC",3,"OTHER"
"3243",8,"COOLHAUS ICE CRM CHOC MLTN",13,"OTHER"
"3244",8,"COOLHAUS ICE CRM DRTY MNT",7,"OTHER"
"3245",8,"COOLHAUS ICE CRM SLT CRML",4,"OTHER"
"3246",8,"COOLHAUS ICE CRM SNDWCH BC",8,"OTHER"
"3247",8,"COOLHAUS ICE CRM SNDWCH CS",12,"OTHER"
"3248",8,"COOLHAUS ICE CRM SNDWCH DCM",19,"OTHER"
"3249",8,"COOLHS ICECRM 3-BAR VMCH",9,"OTHER"
"3250",8,"COOLHS ICECRM SNDWH VN BN",23,"OTHER"
"3251",8,"DAN OIKO GRK FRZ YGRT CAF LATTE",11,"OTHER"
"3252",8,"DAN OIKOS GRK FRZ YGRT CHOC",16,"OTHER"
"3253",8,"DAN OIKOS GRK FRZN YGRT KEY LIME",18,"OTHER"
"3254",8,"DAN OIKOS GRK FRZN YGRT STRWBRY",16,"OTHER"
"3255",8,"DF MAVENS FRZN DSRT",17,"OTHER"
"3256",8,"DF MAVENS FRZN DSRT ND",20,"OTHER"
"3257",8,"DIANA BANABAS BABIES MLK CHOC",35,"OTHER"
"3258",8,"DIANA BANANAS BABIES DRK CHOC",42,"OTHER"
"3259",8,"DIANA BANANAS BABIES MLK CHOC W/PNUT",16,"OTHER"
"3260",8,"DREYER NSA SC VAN BEAN",16,"OTHER"
"3261",8,"DREYER POMEGRANATE BARS",91,"OTHER"
"3262",8,"DREYER'S REAL STRWBRRIES",23,"OTHER"
"3263",8,"DREYERS ASSORTED FRUIT BAR",87,"OTHER"
"3264",8,"DREYERS BUTTER PECAN IC",30,"OTHER"
"3265",8,"DREYERS COOKIE DOUGH",64,"OTHER"
"3266",8,"DREYERS FRN VANILLA ICRM",27,"OTHER"
"3267",8,"DREYERS FRT BAR COCONUT",69,"OTHER"
"3268",8,"DREYERS FRUIT BAR STRAW",125,"OTHER"
"3269",8,"DREYERS LIGHT BUTTER PECAN",43,"OTHER"
"3270",8,"DREYERS LIGHT CHOCOLATE",31,"OTHER"
"3271",8,"DREYERS LIGHT FRENCH VAN",13,"OTHER"
"3272",8,"DREYERS LIGHT MINT",26,"OTHER"
"3273",8,"DREYERS LIGHT ROCKY ROAD",39,"OTHER"
"3274",8,"DREYERS LIGHT STRAWBERRY",8,"OTHER"
"3275",8,"DREYERS LIMITED EDITION",3,"OTHER"
"3276",8,"DREYERS LT CARM DELIGHT",53,"OTHER"
"3277",8,"DREYERS LT VANILLA",94,"OTHER"
"3278",8,"DREYERS MINT CHOC CHIP",79,"OTHER"
"3279",8,"DREYERS NEAPOLITAN",25,"OTHER"
"3280",8,"DREYERS NEST DRUMSTICK",4,"OTHER"
"3281",8,"DREYERS NSA BUTTER PECAN",22,"OTHER"
"3282",8,"DREYERS NSA FDG TRACKS",11,"OTHER"
"3283",8,"DREYERS NSA VANILLA",38,"OTHER"
"3284",8,"DREYERS ROCKY ROAD ICRM",23,"OTHER"
"3285",8,"DREYERS VANILLA ICE CREAM",114,"OTHER"
"3286",8,"DREYERS YOG KEY LIME PIE",7,"OTHER"
"3287",8,"DREYRS SC YOG CRML PRALINE",19,"OTHER"
"3288",8,"DRUMSTICK NESTLE CRUNCH DPED",149,"OTHER"
"3289",8,"DRUMSTICK VANILLA",100,"OTHER"
"3290",8,"DRYRD FRUIT BAR NSA VARIETY",155,"OTHER"
"3291",8,"DRYRS LOADED BUTTERFINGER",42,"OTHER"
"3292",8,"DRYRS LT S/CHRN CKIES/CRM",17,"OTHER"
"3293",8,"DRYRS LT S/CHRN FDG TRACKS",30,"OTHER"
"3294",8,"DRYRS LT S/CHRN LIMITED",2,"OTHER"
"3295",8,"DRYRS LT S/CHRN VAN BEAN",50,"OTHER"
"3296",8,"DRYRS SC YOG CAPPUCCINO CHP",13,"OTHER"
"3297",8,"ESKIMO PIE NSA DARK CHOC",2,"OTHER"
"3298",8,"F'REAL MILKSHAKE CAKE BATTER",24,"OTHER"
"3299",8,"F'REAL MLKSHK COTTON CNDY",61,"OTHER"
"3300",8,"FREAL BL/RSP/POM SMOOTHIE",13,"OTHER"
"3301",8,"FREAL CAPPUCCINO COFFEE",24,"OTHER"
"3302",8,"FREAL MALT MILKSHAKE",10,"OTHER"
"3303",8,"FREAL MANGO SMOOTHIE",11,"OTHER"
"3304",8,"FREAL MILKSHAKE CHOC",61,"OTHER"
"3305",8,"FREAL MILKSHAKE CKIES N CRM",94,"OTHER"
"3306",8,"FREAL MILKSHAKE MINT",28,"OTHER"
"3307",8,"FREAL MILKSHAKE REESES",49,"OTHER"
"3308",8,"FREAL MILKSHAKE STRW",26,"OTHER"
"3309",8,"FREAL MILKSHAKE VAN",30,"OTHER"
"3310",8,"FREAL SMOOTHIE BB RSP PMGRNTE 16OZ",1,"OTHER"
"3311",8,"FREAL SMOOTHIE STRW BNA 16OZ",1,"OTHER"
"3312",8,"FREAL STRW/BAN SMOOTHIE",38,"OTHER"
"3313",8,"FRTARE STRW,MXD BRY,MILK",37,"OTHER"
"3314",8,"FRUITTARE FRT MILK BANANA",18,"OTHER"
"3315",8,"FRUITTARE REAL FRT MANGO",29,"OTHER"
"3316",8,"GANDY I. CRM MOOSE TRACKS",33,"OTHER"
"3317",8,"GANDY I.CRM CARAMEL CARIBOU",34,"OTHER"
"3318",8,"GANDY I.CRM CHERRY VANILLA",28,"OTHER"
"3319",8,"GANDY I.CRM NEAPOLITAN",58,"OTHER"
"3320",8,"GANDY ICE CRM CHOCOLATE",50,"OTHER"
"3321",8,"GANDY ICE CRM VANILLA",151,"OTHER"
"3322",8,"GANDY SLIM & TRM VANILLA",28,"OTHER"
"3323",8,"GANDYS VANILLA ICE CREAM 4QT",207,"OTHER"
"3324",8,"GELATO ROMAN CRM SWRL",14,"OTHER"
"3325",8,"HAAGEN DAZ CUP CHOC PNUT BTTR",139,"OTHER"
"3326",8,"HAAGEN DAZ VAN YOGURT",14,"OTHER"
"3327",8,"HAAGEN DAZS BTR PECAN",108,"OTHER"
"3328",8,"HAAGEN DAZS CHOC ICE CREAM",88,"OTHER"
"3329",8,"HAAGEN DAZS CHOC PNUT BTTR",55,"OTHER"
"3330",8,"HAAGEN DAZS COFFEE IC",133,"OTHER"
"3331",8,"HAAGEN DAZS CUP CHOCOLATE",156,"OTHER"
"3332",8,"HAAGEN DAZS CUP COFFEE",213,"OTHER"
"3333",8,"HAAGEN DAZS CUP VANILLA",251,"OTHER"
"3334",8,"HAAGEN DAZS GELATO CUP SEA SLT CRML",76,"OTHER"
"3335",8,"HAAGEN DAZS GELATO DRK CHOC CHP",27,"OTHER"
"3336",8,"HAAGEN DAZS GELATO LIMONCELLO",43,"OTHER"
"3337",8,"HAAGEN DAZS GELATO SEA SALT CRML",58,"OTHER"
"3338",8,"HAAGEN DAZS GELATO STRACCIATELL",21,"OTHER"
"3339",8,"HAAGEN DAZS GELATO VAN BEAN",7,"OTHER"
"3340",8,"HAAGEN DAZS RUM RAISIN",31,"OTHER"
"3341",8,"HAAGEN-DAZ VAN BEAN",67,"OTHER"
"3342",8,"HAAGN DAZ GELATO CAPPUCCINO",20,"OTHER"
"3343",8,"HAG DAZ VANILLA",117,"OTHER"
"3344",8,"HAGEN DAZ CHOCOLATE",48,"OTHER"
"3345",8,"HAGEN DAZ COFFEE",80,"OTHER"
"3346",8,"HAGEN DAZ STWBRRY IC",96,"OTHER"
"3347",8,"HAGEN DAZ VANILLA ICE CREAM",127,"OTHER"
"3348",8,"HAGEN DAZS CHOC CHOC CHP",47,"OTHER"
"3349",8,"HAGEN DAZS VAN SWSS ALMD",50,"OTHER"
"3350",8,"HAGN DAZ GELATO BLK CHRY AMRTO",35,"OTHER"
"3351",8,"HD CARAMEL CONE CUP",108,"OTHER"
"3352",8,"HD SNACK VAN & ALMND",41,"OTHER"
"3353",8,"HGN DAZS CUP DULC DE LECHE",150,"OTHER"
"3354",8,"JLLY LLMA SORBET 4SQZ PNAPLE",8,"OTHER"
"3355",8,"JOLLY LLAMA SORBET 45QZUP BAN CCNUT",8,"OTHER"
"3356",8,"JOLLY LLAMA SORBET 45QZUP MANGO",10,"OTHER"
"3357",8,"JOLLY LLAMA SORBET 45QZUP RSPBRY",9,"OTHER"
"3358",8,"JOLLY LLAMA SORBET 45QZUP STRWBRY",10,"OTHER"
"3359",8,"JULIES BLACKBERRY SORBET BAR",2,"OTHER"
"3360",8,"JULIES FUDGE BAR",15,"OTHER"
"3361",8,"JULIES ICRM SANDWICH",18,"OTHER"
"3362",8,"KEMPS FF CHOC FRZN YOG",108,"OTHER"
"3363",8,"KEMPS FF CRML PRALINE YOG",105,"OTHER"
"3364",8,"KEMPS FF NSA VAN YOG",110,"OTHER"
"3365",8,"KEMPS FF STRW FRZN YOG",99,"OTHER"
"3366",8,"KEMPS FF VAN FRZN YOG",118,"OTHER"
"3367",8,"KEMPS LF BLK JCK CHRY YOG",104,"OTHER"
"3368",8,"KEMPS LF BTTR PECAN YOG",104,"OTHER"
"3369",8,"KEMPS LF CHOC ALMND",89,"OTHER"
"3370",8,"KEMPS LF CRML BROWNIE YOG",89,"OTHER"
"3371",8,"KEMPS LF MOOSE TRKS YOG",147,"OTHER"
"3372",8,"KEMPS LF SEA SALT CRML YOG",90,"OTHER"
"3373",8,"KEMPS LF VAN BEAN YOG",147,"OTHER"
"3374",8,"KLNDK CKS CRM KANDY BAR",36,"OTHER"
"3375",8,"KLNDK CRML PNUT KANDY BAR",43,"OTHER"
"3376",8,"KLNDK FDGE CRNCH KANDY BR",22,"OTHER"
"3377",8,"KLONDIKE HEATH BAR",85,"OTHER"
"3378",8,"KLONDIKE MINT CHOC CHIP",55,"OTHER"
"3379",8,"KLONDIKE ORIGINAL VAN",151,"OTHER"
"3380",8,"KLONDIKE RED FAT NSA",52,"OTHER"
"3381",8,"KLONDIKE VANILLA SANDWICH",164,"OTHER"
"3382",8,"LIFEWAY KEFIR TT MANGO",22,"OTHER"
"3383",8,"LIFEWAY KEFIR TT ORIGINAL",7,"OTHER"
"3384",8,"LIFEWAY KEFIR TT PMGRANT",12,"OTHER"
"3385",8,"LIFEWAY KEFIR TT STRWBRY",28,"OTHER"
"3386",8,"LUIGIS ITAL ICE VARTY PK",69,"OTHER"
"3387",8,"LUIGIS ITALIAN ICE CHERRY",66,"OTHER"
"3388",8,"LUIGIS ITALIAN ICE NS VRTY",56,"OTHER"
"3389",8,"M/MAID SFT FRZN LEMONADE",36,"OTHER"
"3390",8,"M/MAID SFT FRZN LIMEADE",50,"OTHER"
"3391",8,"MAGNOLIA ICE CREAM CCNUT",10,"OTHER"
"3392",8,"MAGNOLIA ICE CREAM TRPCL AVCDO",15,"OTHER"
"3393",8,"MAGNOLIA ICE CREAM TRPCL UBE",14,"OTHER"
"3394",8,"MAGNUM DBL CRML IC BARS",125,"OTHER"
"3395",8,"MAGNUM GOLD 3PK",59,"OTHER"
"3396",8,"MGNM MINI ALMND WHT VRTY",79,"OTHER"
"3397",8,"MINUTE MAID JUICE BARS",36,"OTHER"
"3398",8,"MONSTER MUNCH BOOGER BATTER",2,"OTHER"
"3399",8,"MONSTER MUNCH POLAR BEAR POOP",1,"OTHER"
"3400",8,"MONSTER MUNCH SPECKLED SLIME",1,"OTHER"
"3401",8,"MONSTER MUNCH T REX ROX",1,"OTHER"
"3402",8,"MOUNDS ICRM BARS",25,"OTHER"
"3403",8,"NE CLASSIC DRMSTICK COMBO",204,"OTHER"
"3404",8,"NE CLASSIC DRMSTK VNLLA",223,"OTHER"
"3405",8,"NESTLE LIL DRUM CHOC SWIRL",45,"OTHER"
"3406",8,"OSD ND CHOC VELVET OG",8,"OTHER"
"3407",8,"OSD ND CREAMY VANILLA OG",10,"OTHER"
"3408",8,"OSD ND NEOPOLITAN",10,"OTHER"
"3409",8,"POPSICLE FIRECRACKER JR",123,"OTHER"
"3410",8,"POPSICLE FUDGSICLE NSA",212,"OTHER"
"3411",8,"POPSICLE OR/GR/CHRY",177,"OTHER"
"3412",8,"POPSICLE S/F OR/CH/GR",248,"OTHER"
"3413",8,"POPSICLE SCRIBBLERS",115,"OTHER"
"3414",8,"POPSICLE SF ORG/CHRY/GRP",84,"OTHER"
"3415",8,"POPSICLE SF TROPICALS",105,"OTHER"
"3416",8,"PPSCL JB TFRTI,VN CHRY,BL",37,"OTHER"
"3417",8,"PPSCLE REDS CHRY,RSP,STRW",95,"OTHER"
"3418",8,"RBYS RCKT DSSRT FRZ GLXY",17,"OTHER"
"3419",8,"RBYS RCKT DSSRT FRZ ORBT",8,"OTHER"
"3420",8,"RBYS RCKT DSSRT FRZ RCK",22,"OTHER"
"3421",8,"REESE'S ICE CREAM CUP",65,"OTHER"
"3422",8,"RICE DREAM BITES VAN",8,"OTHER"
"3423",8,"RICE DREAM VAN",4,"OTHER"
"3424",8,"S.COW CHOC.VAN SANDWICH",75,"OTHER"
"3425",8,"S/COW NSA VANILLA SANDWICH",59,"OTHER"
"3426",8,"SCOOPS BANANA NUT",43,"OTHER"
"3427",8,"SCOOPS BUTTER PECAN",57,"OTHER"
"3428",8,"SCOOPS CHOCOLATE",124,"OTHER"
"3429",8,"SCOOPS CHOCOLATE CHIP",52,"OTHER"
"3430",8,"SCOOPS COOKIES & CREAM",106,"OTHER"
"3431",8,"SCOOPS LOWFAT CHOCOLATE",17,"OTHER"
"3432",8,"SCOOPS LOWFAT VANILLA",23,"OTHER"
"3433",8,"SCOOPS MUDSLIDE COFFEE I/C",38,"OTHER"
"3434",8,"SCOOPS NEOPOLITAN",65,"OTHER"
"3435",8,"SCOOPS ROCKY ROAD",57,"OTHER"
"3436",8,"SCOOPS STRAWBERRY",50,"OTHER"
"3437",8,"SCOOPS TSTD ALMOND FUDGE",68,"OTHER"
"3438",8,"SCOOPS VANILLA",294,"OTHER"
"3439",8,"SCOOPS VANILLA FUDGE",63,"OTHER"
"3440",8,"SK ICE CRM SAND LF VAN",61,"OTHER"
"3441",8,"SKINNY COW COOKIES & CRM",75,"OTHER"
"3442",8,"SKINNY COW FUDGE BAR",68,"OTHER"
"3443",8,"SLIM A BEAR 100CAL VAN BAR",98,"OTHER"
"3444",8,"SLIM ABEAR 100CA TOFF/FRVAN",118,"OTHER"
"3445",8,"SNICKERS BAR",139,"OTHER"
"3446",8,"SNICKERS ICE CRM BARS",146,"OTHER"
"3447",8,"SO DEL BAR CNUT ICRM ALM",19,"OTHER"
"3448",8,"SO DEL CNUT BAN SPLT MINI SNDW",9,"OTHER"
"3449",8,"SO DEL COCNT CHOC ICRM",18,"OTHER"
"3450",8,"SO DEL COCONT CKY DGH",32,"OTHER"
"3451",8,"SO DEL COCONT MLK ICRM",12,"OTHER"
"3452",8,"SO DEL COCONT MOCHA",20,"OTHER"
"3453",8,"SO DEL COCONT VAN",18,"OTHER"
"3454",8,"SO DELICIO SYICRM MIN SAN VAN",21,"OTHER"
"3455",8,"SOY DELC CHOC OBESSN OG2",17,"OTHER"
"3456",8,"STN RDG BAN SPLT ICRM",57,"OTHER"
"3457",8,"STN RDG CH ALM FDG ICRM",72,"OTHER"
"3458",8,"STN RDG CH CHRY BRDX ICRM",37,"OTHER"
"3459",8,"STN RDG CHC CHP ICRM SCRND",57,"OTHER"
"3460",8,"STN RDG CHOC ICRM SCRND",125,"OTHER"
"3461",8,"STN RDG CKS N CRM ICRM SC",103,"OTHER"
"3462",8,"STN RDG CRM PRLN PCN ICRM",98,"OTHER"
"3463",8,"STN RDG CRML CHSCK ICRM",55,"OTHER"
"3464",8,"STN RDG CRML WFL CNE ICRM",69,"OTHER"
"3465",8,"STN RDG DB BRY CHSCK ICRM",59,"OTHER"
"3466",8,"STN RDG DBL VAN ICRM",226,"OTHER"
"3467",8,"STN RDG FR VAN ICRM SCRND",140,"OTHER"
"3468",8,"STN RDG IC SNDWCH",279,"OTHER"
"3469",8,"STN RDG KRNCH ICRM BAR",69,"OTHER"
"3470",8,"STN RDG MINI SNDWCH",83,"OTHER"
"3471",8,"STN RDG NPLTN ICRM SCRND",97,"OTHER"
"3472",8,"STN RDG ORANGE SHERBET",95,"OTHER"
"3473",8,"STN RDG PISTCH ICRM SCRND",56,"OTHER"
"3474",8,"STN RDG PNT BTR CUP ICRM",80,"OTHER"
"3475",8,"STN RDG POLAR ICECRM BAR",28,"OTHER"
"3476",8,"STN RDG RAINBOW SHERBET",122,"OTHER"
"3477",8,"STN RDG RASP SHERBET",95,"OTHER"
"3478",8,"STN RDG SLTD CRML ICRM",56,"OTHER"
"3479",8,"STN RDG SPUMONI ICRM",33,"OTHER"
"3480",8,"STN RDG STRW ICRM SCRND",55,"OTHER"
"3481",8,"STN RDG VAN ICRM BRS",154,"OTHER"
"3482",8,"STN RDG VAN ICRM SCRND",266,"OTHER"
"3483",8,"STNYFLD FRZN YOG DRK CHOC",33,"OTHER"
"3484",8,"STNYFLD LF MNT CHO YGRT OG2",8,"OTHER"
"3485",8,"STNYFLD NF VAN FDG YGRT OG2",27,"OTHER"
"3486",8,"STNYFLD NF VAN YOGRT OG2",18,"OTHER"
"3487",8,"STNYFLD YGRT FRZ NF BAR VAN W/CHOC",27,"OTHER"
"3488",8,"STONY YGRT GRK FRZ FF VAN",19,"OTHER"
"3489",8,"STONY YOGURT FRZ FF BLBRY",19,"OTHER"
"3490",8,"STONY YOGURT FRZ FF CHOC",28,"OTHER"
"3491",8,"STONY YOGURT FRZ FF HONEY",8,"OTHER"
"3492",8,"SV ASSTD POPS",75,"OTHER"
"3493",8,"SV CHOC CHIP ICRM SQUARE",3,"OTHER"
"3494",8,"SV CHOC ICE CREAM SQUARE",6,"OTHER"
"3495",8,"SV CHOC PAIL ICE CREAM",76,"OTHER"
"3496",8,"SV FUDGE BARS",50,"OTHER"
"3497",8,"SV NEAPLTN ICE CRM SQUARE",2,"OTHER"
"3498",8,"SV NEAPOLITAN PAIL ICECRM",136,"OTHER"
"3499",8,"SV RD WHT BLUE POPS",17,"OTHER"
"3500",8,"SV STRW PAIL ICE CREAM",56,"OTHER"
"3501",8,"SV VANILLA PAIL ICE CREAM",265,"OTHER"
"3502",8,"SWT FRDM VAN ICRM CONE",34,"OTHER"
"3503",8,"SYDRM BTR PCAN DSERT",17,"OTHER"
"3504",8,"TALENTI BLOOD ORANGE SORBETTO",15,"OTHER"
"3505",8,"TALENTI GEL FUDGE BROWNIE",80,"OTHER"
"3506",8,"TALENTI GELATO CARIBBEAN COCONUT",49,"OTHER"
"3507",8,"TALENTI GELATO CH/PNT BTR CUP",65,"OTHER"
"3508",8,"TALENTI GELATO CRML CKIE CRNCH",135,"OTHER"
"3509",8,"TALENTI GELATO DBE DRK CHOC",68,"OTHER"
"3510",8,"TALENTI GELATO MILK CHOC",70,"OTHER"
"3511",8,"TALENTI GELATO PISTACHIO",108,"OTHER"
"3512",8,"TALENTI GELATO ROMAN RASP SORBETTO",71,"OTHER"
"3513",8,"TALENTI GELATO SCLN PSTCHO",1,"OTHER"
"3514",8,"TALENTI GELATO SEA SALT",112,"OTHER"
"3515",8,"TALENTI GELATO VANILLA BEAN",107,"OTHER"
"3516",8,"TFTT CUTIS MNT CHCHP DF",6,"OTHER"
"3517",8,"THR TWNS IC CRM STRWBRY",6,"OTHER"
"3518",8,"THREE TWINS ICE CRM CRML",11,"OTHER"
"3519",8,"THREE TWINS ICECRM SNDWCH",8,"OTHER"
"3520",8,"THREE TWNS ICE CRM CHOC",19,"OTHER"
"3521",8,"THREE TWNS ICE CRM VAN",5,"OTHER"
"3522",8,"THREE TWNS ICE CRM VAN C",9,"OTHER"
"3523",8,"TLNTI GEL BLK RSP CHC CHP",57,"OTHER"
"3524",8,"TOFUTTI CUTIES CHOCOLATE",6,"OTHER"
"3525",8,"TOFUTTI CUTIES VANILLA",16,"OTHER"
"3526",8,"WONKA PUSH UP 9 CT BOX",32,"OTHER"
"3527",8,"WW BLBRY SWRL BARS",73,"OTHER"
"3528",8,"WW CANDY BARS 6/2 FL OZ",92,"OTHER"
"3529",8,"WW CHOC SMTH BARS",29,"OTHER"
"3530",8,"WW CKIES&CRM BARS",61,"OTHER"
"3531",8,"WW DIVINE TRIPLE CHOCOLATE BARS",43,"OTHER"
"3532",8,"WW DRK CHC DULCE DE LECHE",56,"OTHER"
"3533",8,"WW DRK CHOC RSPB BARS",79,"OTHER"
"3534",8,"WW ENGLSH TFEE CRCH BAR",116,"OTHER"
"3535",8,"WW GIANT CHOC FUDGE BAR",132,"OTHER"
"3536",8,"WW GIANT LATTE BAR",30,"OTHER"
"3537",8,"WW PCH SWIRL BARS",52,"OTHER"
"3538",8,"WW SLTD CRML ICECRM BAR",93,"OTHER"
"3539",8,"WW SNACK SIZE VAN FUDGE SWRL CONES",60,"OTHER"
"3540",8,"WW SNK SZ CHOC FDG BARS",97,"OTHER"
"3541",8,"WW SNK SZ VP ICE CRM SNDWCH",50,"OTHER"
"3542",8,"WW STRAW SWRL GRK FRZN YOG",7,"OTHER"
"3543",8,"WW STRW SMOOTHIE BARS",56,"OTHER"
"3544",8,"WW VAN RND ICE CRM SNDWCH",90,"OTHER"
"3545",8,"YASSO BLBRY BAR",37,"OTHER"
"3546",8,"YASSO COCONUT BAR",39,"OTHER"
"3547",8,"YASSO MANGO BAR",40,"OTHER"
"3548",8,"YASSO RASP BAR",44,"OTHER"
"3549",8,"YASSO STRW BAR",36,"OTHER"
"3550",8,"YORK PEPPERMINT ICRM PATTY",19,"OTHER"
"3551",9,"*CV*DIPPIN DOT COTTON CANDY",36,"OTHER"
"3552",9,"*CV*DIPPIN DOTS BAN SPLIT",63,"OTHER"
"3553",9,"*CV*DIPPIN DOTS BIRTHDAY CAKE",7,"OTHER"
"3554",9,"*CV*DIPPIN DOTS CHOC",60,"OTHER"
"3555",9,"*CV*DIPPIN DOTS CKIE DGH",41,"OTHER"
"3556",9,"*CV*DIPPIN DOTS CKIES/CRM",26,"OTHER"
"3557",9,"*CV*DIPPIN DOTS ICE RNBW",63,"OTHER"
"3558",9,"*CV*DIPPIN DOTS MINT CHOC",11,"OTHER"
"3559",9,"*CV*DIPPIN DOTS VAN ICE CRM",52,"OTHER"
"3560",9,"*D* BDGT SVR BANANA POPS",50,"OTHER"
"3561",9,"*D*BUDGET SAVER SF TWIN POPS",47,"OTHER"
"3562",9,"*D*GOOD HUMOR KING CONE VANILLA",21,"OTHER"
"3563",9,"*R* DREYERS FRT BAR LIME",126,"OTHER"
"3564",9,"*R* HD DULCE DE LECHE CARAMEL",38,"OTHER"
"3565",9,"*S*KEMP'S CANDY CANE ICECREAM",3,"OTHER"
"3566",9,"*S*KEMP'S CINNAMON ICECREAM",6,"OTHER"
"3567",9,"*S*KEMP'S HLDY VAN ICECREAM",1,"OTHER"
"3568",9,"*S*KEMP'S PUMPKIN PIE ICECREAM",6,"OTHER"
"3569",9,"*Z*CADBURY CARAMELLO RED FAT IC BAR",1,"OTHER"
"3570",9,"ALDENS IC SALTED CARAMEL",14,"OTHER"
"3571",9,"ALDENS ICE CREAM CHOC CHP",26,"OTHER"
"3572",9,"ALDENS ICE CREAM CKIE CRM",14,"OTHER"
"3573",9,"ALDENS ICE CREAM VANILLA",60,"OTHER"
"3574",9,"ALDENS ICRM MINT CHIP OG2",17,"OTHER"
"3575",9,"ALMOND DREAM CAPP SWIRL",25,"OTHER"
"3576",9,"ALMOND DREAM CHOC",18,"OTHER"
"3577",9,"ALMOND DREAM CHOC BITES",17,"OTHER"
"3578",9,"ALMOND DREAM ICECRM SNDWCH",8,"OTHER"
"3579",9,"ALMOND DREAM PRLN CRNCH",38,"OTHER"
"3580",9,"ALMOND DREAM VNLA",9,"OTHER"
"3581",9,"ALMOND DREAM VNLA BITE",15,"OTHER"
"3582",9,"ARTIC ZERO ICE CRM CHOC",1,"OTHER"
"3583",9,"ARTIC ZERO ICE CRM CHOC PNUT BTR",44,"OTHER"
"3584",9,"ARTIC ZERO ICE CRM COOKIE N CRM",34,"OTHER"
"3585",9,"ARTIC ZERO ICE CRM VANILLA",29,"OTHER"
"3586",9,"B BELL ASST FRZN YOGURT HG",-2,"OTHER"
"3587",9,"B BELL ASST GOLD ICE CRM HG",-72,"OTHER"
"3588",9,"B BELL BROWN RIM I/CREAM HG",-40,"OTHER"
"3589",9,"B BELL LIGHT I/CREAM HG",-5,"OTHER"
"3590",9,"B BELL NO SUGAR ADDED HG",-14,"OTHER"
"3591",9,"B BUNNY MINI SWRL VAN CONES",221,"OTHER"
"3592",9,"B&J BAN P/BTR GRK YOG",35,"OTHER"
"3593",9,"B&J BLBRY VAN GRHM GRK YOG",29,"OTHER"
"3594",9,"B&J CHEESECAKE BROWNIE",75,"OTHER"
"3595",9,"B&J CHERRY GARCIA",229,"OTHER"
"3596",9,"B&J CHERRY GARCIA CUP",166,"OTHER"
"3597",9,"B&J CHOC FDG BROWNIE",201,"OTHER"
"3598",9,"B&J CHOC FDG BROWNIE CUP",309,"OTHER"
"3599",9,"B&J CHOCC CHP COOKIE DOUGH",212,"OTHER"
"3600",9,"B&J CHUNKEY MONKEY",138,"OTHER"
"3601",9,"B&J CINNAMON BUNS",69,"OTHER"
"3602",9,"B&J COFFEE BUZZ",105,"OTHER"
"3603",9,"B&J COFFEE W/HEATH",126,"OTHER"
"3604",9,"B&J COOKIE DOUGH CUP",330,"OTHER"
"3605",9,"B&J FY CHERRY GARCIA",99,"OTHER"
"3606",9,"B&J KARAMEL SUTRA",120,"OTHER"
"3607",9,"B&J MILK & COOKIES",204,"OTHER"
"3608",9,"B&J NEW YORK SUPER FUDGE",91,"OTHER"
"3609",9,"B&J PEANUT BUTTER CUP",124,"OTHER"
"3610",9,"B&J PHISH FOOD PT",177,"OTHER"
"3611",9,"B&J PNT BTTR FUDGE CORE",83,"OTHER"
"3612",9,"B&J RASP FDG CHNK GRK YOG",34,"OTHER"
"3613",9,"B&J RED VELVET CAKE ICE CRM",64,"OTHER"
"3614",9,"B&J SLTD CARAMEL CORE",124,"OTHER"
"3615",9,"B&J STPHN COLBRT AMRICNE DREAM",192,"OTHER"
"3616",9,"B&J STRW SHRCK GRK YOG",57,"OTHER"
"3617",9,"B&J VANILLA",63,"OTHER"
"3618",9,"B.BELL FUDGE BARS",-3,"OTHER"
"3619",9,"B/BNY SWT FREEDOM VAN SNK SZ CONES",79,"OTHER"
"3620",9,"BB BDAY PARTY SNDWCH",70,"OTHER"
"3621",9,"BB BORDEAUX CHRY CHOC",138,"OTHER"
"3622",9,"BB BULLETS",-1,"OTHER"
"3623",9,"BB CHAMP VAR PK CONES",151,"OTHER"
"3624",9,"BB CHOC CHRY BARS",-1,"OTHER"
"3625",9,"BB DIPPED COCONUT FRT BARS",-3,"OTHER"
"3626",9,"BB ICE CREAM SANDWICH",-1,"OTHER"
"3627",9,"BB MINI SANDWICH",-7,"OTHER"
"3628",9,"BB MINI SWIRL CRML CONES",116,"OTHER"
"3629",9,"BB MINI SWRL BDAY PRTY CONE",72,"OTHER"
"3630",9,"BB PREM BUNNY TRACKS",243,"OTHER"
"3631",9,"BB PREM BUTTER PECAN",227,"OTHER"
"3632",9,"BB PREM CHUNKY CHOC CHIP",150,"OTHER"
"3633",9,"BB PREM COOKIES N CREAM",348,"OTHER"
"3634",9,"BB PREM DBL STRWBRY",174,"OTHER"
"3635",9,"BB PREM HOMEMADE CHOC",351,"OTHER"
"3636",9,"BB PREM HOMEMADE VAN",825,"OTHER"
"3637",9,"BB PREM MINT CHOC CHIP",299,"OTHER"
"3638",9,"BB PREM NEAPOLITAN",171,"OTHER"
"3639",9,"BB PREM PNUT BTTR PANIC",211,"OTHER"
"3640",9,"BB PREM ROCKY ROAD",200,"OTHER"
"3641",9,"BB PREM TSTD ALMND FUDGE",158,"OTHER"
"3642",9,"BB RAINBOW FREEZE SINGLE",-1,"OTHER"
"3643",9,"BB SMPLY VAN SNCWCH",335,"OTHER"
"3644",9,"BB STRW FRUIT BARS",-2,"OTHER"
"3645",9,"BB STRWBRRY DPPD FRT BARS",-4,"OTHER"
"3646",9,"BB SUNDAE CUPS",-1,"OTHER"
"3647",9,"BB SWEET FREEDOM VAN",208,"OTHER"
"3648",9,"BB SWT FRDM BAN SPLIT",101,"OTHER"
"3649",9,"BB SWT FRDM BTR PECAN",123,"OTHER"
"3650",9,"BB SWT FRDM BUNNY TRACKS",122,"OTHER"
"3651",9,"BB SWT FRDM VRTY PK BARS",45,"OTHER"
"3652",9,"BB TRPL DLGHT SNDWCH",206,"OTHER"
"3653",9,"BBNY CARAMEL KRUNCH BARS",104,"OTHER"
"3654",9,"BBNY CHAMP CONE VAN",236,"OTHER"
"3655",9,"BBNY FUDGE BARS",111,"OTHER"
"3656",9,"BBNY SWT FRDM IC LITES",48,"OTHER"
"3657",9,"BBNY SWT FRDM KRNCH LT",10,"OTHER"
"3658",9,"BBUNNY PREM PIST ALMOND",110,"OTHER"
"3659",9,"BBUNNY SWT FRDM FDG LT",53,"OTHER"
"3660",9,"BJ SMORES",118,"OTHER"
"3661",9,"BL BUNNY PREM VAN BEAN",514,"OTHER"
"3662",9,"BLUE BUNNY BIG FUDGE BARS",161,"OTHER"
"3663",9,"BLUE BUNNY ORANGE DREAM BAR 2.25OZ",121,"OTHER"
"3664",9,"BLUE BUNNY ORIG BOMB POP",254,"OTHER"
"3665",9,"BLUE BUNNY PREM VAN",585,"OTHER"
"3666",9,"BOMB POP HWN PNCH",137,"OTHER"
"3667",9,"BOMB POPS WATERMELON",135,"OTHER"
"3668",9,"BREYER NAT LT CRMY VANILLA",49,"OTHER"
"3669",9,"BREYER NTRL CHRY VANILLA",81,"OTHER"
"3670",9,"BREYER NTRL FRCH VAN",186,"OTHER"
"3671",9,"BREYER VANILLA ICE CREAM",193,"OTHER"
"3672",9,"BREYER WFL CONE W/HRSHY CHOC CHP",79,"OTHER"
"3673",9,"BREYERS BLASTS BDAY",67,"OTHER"
"3674",9,"BREYERS BLASTS CREAMSICLE",41,"OTHER"
"3675",9,"BREYERS CARB SMART CHOC",76,"OTHER"
"3676",9,"BREYERS CO B GS THIN MINTS",82,"OTHER"
"3677",9,"BREYERS CO BRAND M&MS",50,"OTHER"
"3678",9,"BREYERS FAT FREE CRMY VAN",42,"OTHER"
"3679",9,"BREYERS LACTOSE FREE VAN",98,"OTHER"
"3680",9,"BREYERS NAT ROCKY ROAD",81,"OTHER"
"3681",9,"BREYERS NAT STRAWBERRY",89,"OTHER"
"3682",9,"BREYERS NSA VANILLA",71,"OTHER"
"3683",9,"BREYERS NTRL CHOC",102,"OTHER"
"3684",9,"BREYERS SNICKERS IC CRM",105,"OTHER"
"3685",9,"BRYER SMRT CARB VAN I/C",92,"OTHER"
"3686",9,"BRYERS OREO CHOC CKIE&CRM",78,"OTHER"
"3687",9,"BRYRS CRBSMRT ALMD I/C BAR",90,"OTHER"
"3688",9,"BRYRS TIRAMISU GELATO",67,"OTHER"
"3689",9,"BRYRS TRPL CHOC GELATO",51,"OTHER"
"3690",9,"BRYRS VAN CRML GELATO",125,"OTHER"
"3691",9,"CADBURY CARAMELLO RF IC BAR",26,"OTHER"
"3692",9,"CADBURY CHOC ALMD RF IC BAR",30,"OTHER"
"3693",9,"CHOCO TACO",16,"OTHER"
"3694",9,"CIAO BELLA KEY LIME GRHM GEL SQ",36,"OTHER"
"3695",9,"CLEMMYS IC CHOC CHIP",14,"OTHER"
"3696",9,"CLEMMYS IC CHOCOLATE",12,"OTHER"
"3697",9,"CLEMMYS IC COFFEE",4,"OTHER"
"3698",9,"CLEMMYS IC TSTD ALMOND",7,"OTHER"
"3699",9,"CLEMMYS IC VANILLA BEAN",17,"OTHER"
"3700",9,"COOLHAUS IC SNDWCH CHOC",10,"OTHER"
"3701",9,"COOLHAUS IC SNDWCH PNTBTR",9,"OTHER"
"3702",9,"COOLHAUS ICE CRM 3-BAR CH",5,"OTHER"
"3703",9,"COOLHAUS ICE CRM 3-BAR M CH",10,"OTHER"
"3704",9,"COOLHAUS ICE CRM BANA FSTR",22,"OTHER"
"3705",9,"COOLHAUS ICE CRM BLSMC",9,"OTHER"
"3706",9,"COOLHAUS ICE CRM CHOC MLTN",25,"OTHER"
"3707",9,"COOLHAUS ICE CRM DRTY MNT",32,"OTHER"
"3708",9,"COOLHAUS ICE CRM SLT CRML",10,"OTHER"
"3709",9,"COOLHAUS ICE CRM SNDWCH BC",11,"OTHER"
"3710",9,"COOLHAUS ICE CRM SNDWCH CS",14,"OTHER"
"3711",9,"COOLHAUS ICE CRM SNDWCH DCM",18,"OTHER"
"3712",9,"COOLHS ICECRM 3-BAR VMCH",7,"OTHER"
"3713",9,"COOLHS ICECRM SNDWH VN BN",19,"OTHER"
"3714",9,"DAN OIKO GRK FRZ YGRT CAF LATTE",8,"OTHER"
"3715",9,"DAN OIKOS GRK FRZ YGRT CHOC",20,"OTHER"
"3716",9,"DAN OIKOS GRK FRZN YGRT KEY LIME",26,"OTHER"
"3717",9,"DAN OIKOS GRK FRZN YGRT STRWBRY",23,"OTHER"
"3718",9,"DF MAVENS FRZN DSRT ND",34,"OTHER"
"3719",9,"DIANA BANABAS BABIES MLK CHOC",38,"OTHER"
"3720",9,"DIANA BANANAS BABIES DRK CHOC",28,"OTHER"
"3721",9,"DIANA BANANAS BABIES MLK CHOC W/PNUT",11,"OTHER"
"3722",9,"DREYER NSA SC VAN BEAN",9,"OTHER"
"3723",9,"DREYER POMEGRANATE BARS",122,"OTHER"
"3724",9,"DREYER'S REAL STRWBRRIES",36,"OTHER"
"3725",9,"DREYERS ASSORTED FRUIT BAR",172,"OTHER"
"3726",9,"DREYERS BUTTER PECAN IC",42,"OTHER"
"3727",9,"DREYERS COOKIE DOUGH",66,"OTHER"
"3728",9,"DREYERS FRN VANILLA ICRM",31,"OTHER"
"3729",9,"DREYERS FRT BAR COCONUT",153,"OTHER"
"3730",9,"DREYERS FRUIT BAR STRAW",180,"OTHER"
"3731",9,"DREYERS LIGHT BUTTER PECAN",62,"OTHER"
"3732",9,"DREYERS LIGHT CHOCOLATE",27,"OTHER"
"3733",9,"DREYERS LIGHT FRENCH VAN",5,"OTHER"
"3734",9,"DREYERS LIGHT MINT",30,"OTHER"
"3735",9,"DREYERS LIGHT ROCKY ROAD",50,"OTHER"
"3736",9,"DREYERS LIGHT STRAWBERRY",17,"OTHER"
"3737",9,"DREYERS LIMITED EDITION",11,"OTHER"
"3738",9,"DREYERS LT CARM DELIGHT",66,"OTHER"
"3739",9,"DREYERS LT VANILLA",92,"OTHER"
"3740",9,"DREYERS MINT CHOC CHIP",75,"OTHER"
"3741",9,"DREYERS NEAPOLITAN",28,"OTHER"
"3742",9,"DREYERS NEST DRUMSTICK",6,"OTHER"
"3743",9,"DREYERS NSA BUTTER PECAN",43,"OTHER"
"3744",9,"DREYERS NSA FDG TRACKS",10,"OTHER"
"3745",9,"DREYERS NSA VANILLA",51,"OTHER"
"3746",9,"DREYERS ROCKY ROAD ICRM",68,"OTHER"
"3747",9,"DREYERS VANILLA ICE CREAM",91,"OTHER"
"3748",9,"DREYERS YOG KEY LIME PIE",1,"OTHER"
"3749",9,"DREYERS YOGURT FF VAN",12,"OTHER"
"3750",9,"DREYRS SC YOG CRML PRALINE",35,"OTHER"
"3751",9,"DRUMSTICK NESTLE CRUNCH DPED",195,"OTHER"
"3752",9,"DRUMSTICK VANILLA",119,"OTHER"
"3753",9,"DRYRD FRUIT BAR NSA VARIETY",193,"OTHER"
"3754",9,"DRYRS LOADED BUTTERFINGER",11,"OTHER"
"3755",9,"DRYRS LT S/CHRN CKIES/CRM",23,"OTHER"
"3756",9,"DRYRS LT S/CHRN FDG TRACKS",30,"OTHER"
"3757",9,"DRYRS LT S/CHRN LIMITED",12,"OTHER"
"3758",9,"DRYRS LT S/CHRN VAN BEAN",34,"OTHER"
"3759",9,"DRYRS SC YOG CAPPUCCINO CHP",29,"OTHER"
"3760",9,"F'REAL MILKSHAKE CAKE BATTER",2,"OTHER"
"3761",9,"F'REAL MLKSHK COTTON CNDY",33,"OTHER"
