"","Month","LongDes","TotItemQty","Brand"
"1",1,"*CV*DIPPIN DOTS BAN SPLIT",86,"OTHER"
"2",1,"*CV*DIPPIN DOTS CHOC",76,"OTHER"
"3",1,"*CV*DIPPIN DOTS CKIE DGH",49,"OTHER"
"4",1,"*CV*DIPPIN DOTS CKIES/CRM",60,"OTHER"
"5",1,"*CV*DIPPIN DOTS COTTON CANDY",17,"OTHER"
"6",1,"*CV*DIPPIN DOTS ICE RNBW",132,"OTHER"
"7",1,"*CV*DIPPIN DOTS MINT CHOC",47,"OTHER"
"8",1,"*CV*DIPPIN DOTS STRAWBERRY",19,"OTHER"
"9",1,"*CV*DIPPIN DOTS VAN ICE CRM",38,"OTHER"
"10",1,"*D* CLEMMYS IC COFFEE",3,"OTHER"
"11",1,"*D*B&JS COLBERT AMERICONE DRM 16OZ",1,"OTHER"
"12",1,"*D*HD CHOCOLATE CUP 24PK",1,"OTHER"
"13",1,"*D*HD COFFEE CUP 24PK",1,"OTHER"
"14",1,"*D*HD DULCE DE LECHE CUP 24PK",1,"OTHER"
"15",1,"*D*HD VANILLA CUP 24PK",1,"OTHER"
"16",1,"*D*TALENTI GELATO MILK CHOC",1,"OTHER"
"17",1,"*R* DREYERS FRT BAR LIME 6CT",105,"OTHER"
"18",1,"*R* HD DULCE DE LECHE CARAMEL 14OZ",49,"OTHER"
"19",1,"*Z*CADBURY CARAMELLO RED FAT IC BAR",1,"OTHER"
"20",1,"ALDENS ICE CREAM CHOC CHP 48OZ",13,"OTHER"
"21",1,"ALDENS ICE CREAM CKIE CRM 48OZ",4,"OTHER"
"22",1,"ALDENS ICE CREAM VANILLA 48OZ",27,"OTHER"
"23",1,"ALDENS ICRM MINT CHIP OG2 48OZ",2,"OTHER"
"24",1,"ALMD DRM BITES VAN 6.6 OZ",9,"OTHER"
"25",1,"ALMD DRM CHOCOLATE FROZN 16 OZ",21,"OTHER"
"26",1,"ALMD DRM PRALINE CRNCH 16OZ",33,"OTHER"
"27",1,"ALMD DRM VANILLA FROZL 16 OZ",3,"OTHER"
"28",1,"ARTIC ZERO ICE CRM CHOC",26,"OTHER"
"29",1,"ARTIC ZERO ICE CRM CHOC PNUT BTTR",26,"OTHER"
"30",1,"ARTIC ZERO ICE CRM COFFEE",24,"OTHER"
"31",1,"ARTIC ZERO ICE CRM COOKIE N CRM",50,"OTHER"
"32",1,"ARTIC ZERO ICE CRM MINT CHOC CKY",23,"OTHER"
"33",1,"ARTIC ZERO ICE CRM VANILLA",47,"OTHER"
"34",1,"B BELL ASST FRZN YOGURT HG 64OZ",71,"OTHER"
"35",1,"B BELL ASST GOLD ICE CRM HG 64OZ",5223,"OTHER"
"36",1,"B BELL BROWN RIM I/CREAM HG 64OZ",2081,"OTHER"
"37",1,"B BELL LIGHT I/CREAM HG 64OZ",172,"OTHER"
"38",1,"B BELL NO SUGAR ADDED HG 64OZ",339,"OTHER"
"39",1,"B&J BAN P/BTR GRK YOG",19,"OTHER"
"40",1,"B&J BLBRY VAN GRHM GRK YOG",16,"OTHER"
"41",1,"B&J CHEESECAKE BROWNIE 16OZ",50,"OTHER"
"42",1,"B&J CHERRY GARCIA 16OZ",121,"OTHER"
"43",1,"B&J CHERRY GARCIA CUP 12PK",117,"OTHER"
"44",1,"B&J CHOC FDG BROWNIE 16OZ",115,"OTHER"
"45",1,"B&J CHOC FDG BROWNIE CUP 12PK",19,"OTHER"
"46",1,"B&J CHOCC CHP COOKIE DOUGH 16OZ",94,"OTHER"
"47",1,"B&J CHUNKEY MONKEY 16OZ",53,"OTHER"
"48",1,"B&J CINNAMON BUNS 16OZ",61,"OTHER"
"49",1,"B&J COFFEE BUZZ",45,"OTHER"
"50",1,"B&J COFFEE W/HEATH 16OZ",45,"OTHER"
"51",1,"B&J COOKIE DOUGH CUP 12PK",268,"OTHER"
"52",1,"B&J FY CHERRY GARCIA",54,"OTHER"
"53",1,"B&J KARAMEL SUTRA 16OZ",80,"OTHER"
"54",1,"B&J LMN BLBRY GRK YOG",3,"OTHER"
"55",1,"B&J MILK & COOKIES",77,"OTHER"
"56",1,"B&J NEW YORK SUPER FUDGE 16OZ",36,"OTHER"
"57",1,"B&J PEANUT BUTTER CUP 16OZ",45,"OTHER"
"58",1,"B&J PHISH FOOD PT 16OZ",90,"OTHER"
"59",1,"B&J RASP FDG CHNK GRK YOG",20,"OTHER"
"60",1,"B&J RED VELVET CAKE ICE CRM",34,"OTHER"
"61",1,"B&J STEPHEN COLBERTS AMERICONE DREAM",91,"OTHER"
"62",1,"B&J STRW SHRCK GRK YOG",20,"OTHER"
"63",1,"B&J VANILLA",3,"OTHER"
"64",1,"B&J VANILLA 16OZ",1,"OTHER"
"65",1,"B&J YOGURT CHERRY GARCIA",1,"OTHER"
"66",1,"B.BELL FUDGE BARS 12EA",580,"OTHER"
"67",1,"B/BNY SWEET FREEDOM VAN SNACK SIZE CONES",45,"OTHER"
"68",1,"BB ALMOND BAR SINGLE 1EA",13,"OTHER"
"69",1,"BB BANANA FUDGE BAR",266,"OTHER"
"70",1,"BB BDAY PARTY SNDWCH 8PK",30,"OTHER"
"71",1,"BB BULLETS 24EA",130,"OTHER"
"72",1,"BB CHAMP VAR PK CONES",47,"OTHER"
"73",1,"BB CHOC & VAN CUPS 12EA",293,"OTHER"
"74",1,"BB CHOC CHIP COOKIE SINGLE 5,25OZ",160,"OTHER"
"75",1,"BB CHOC CHRY BARS 12PK",53,"OTHER"
"76",1,"BB CHOC FUDGE BAR",77,"OTHER"
"77",1,"BB CKS/CREAM SANDWICH SINGLE 1EA",208,"OTHER"
"78",1,"BB CNTRY CONE CKS/CRM SGL 1EA",200,"OTHER"
"79",1,"BB CNTRY CONE VANILLA SINGLE 1EA",212,"OTHER"
"80",1,"BB CREME POPS 24EA",56,"OTHER"
"81",1,"BB DIPPED COCONUT FRT BARS",132,"OTHER"
"82",1,"BB FUDGE BOMBSTIK SINGLE 1EA",473,"OTHER"
"83",1,"BB GREAT DIVIDE SINGLES 1EA",13,"OTHER"
"84",1,"BB HOMEMADE VANILLA CUP SGL 1EA",181,"OTHER"
"85",1,"BB ICE CREAM SANDWICH 12EA",271,"OTHER"
"86",1,"BB ICE CREAM SANDWICH SINGLE 1EA",203,"OTHER"
"87",1,"BB KRUNCH BAR SINGLE 1EA",69,"OTHER"
"88",1,"BB LIME FRUIT BAR SNGLE",16,"OTHER"
"89",1,"BB MINI SANDWICH 24EA",195,"OTHER"
"90",1,"BB MINI SWIRL CRML CONES 18OZ",51,"OTHER"
"91",1,"BB MINT CCHIP BARS",106,"OTHER"
"92",1,"BB MIXED BERRIES FRT BARS",173,"OTHER"
"93",1,"BB NEAO SANDWICH SINGLE 5,75OZ",88,"OTHER"
"94",1,"BB NSA MOOO BARS 12EA",100,"OTHER"
"95",1,"BB RAINBOW FREEZE SINGLE 1EA",171,"OTHER"
"96",1,"BB RAINBOW POP UPS SINGLE 1EA",98,"OTHER"
"97",1,"BB SMPLY VAN SNCWCH 8PK",50,"OTHER"
"98",1,"BB STRW FRUIT BARS",501,"OTHER"
"99",1,"BB SUNDAE CUPS",99,"OTHER"
"100",1,"BB TRPL DLGHT SNDWCH 8PK",47,"OTHER"
"101",1,"BBNY CARAMEL KRUNCH BARS 12EA",35,"OTHER"
"102",1,"BBNY CHAMP CONE VAN 6EA",58,"OTHER"
"103",1,"BBNY FUDGE BARS 12EA",11,"OTHER"
"104",1,"BBNY SWT FRDM IC LITES 12EA",51,"OTHER"
"105",1,"BBNY SWT FRDM KRNCH LT 12EA",42,"OTHER"
"106",1,"BBUNNY SWT FRDM FDG LT 12PK 12EA",52,"OTHER"
"107",1,"BJ SMORES 16OZ",56,"OTHER"
"108",1,"BLU BUNNY MINI SWRL BDAY PARTY IC CONE",31,"OTHER"
"109",1,"BLUE BUNNY BIG FUDGE BARS",85,"OTHER"
"110",1,"BLUE BUNNY MINI SWIRLS VANILLA CONES 18OZ",86,"OTHER"
"111",1,"BLUE BUNNY ORANGE DREAM BAR 2.25OZ",39,"OTHER"
"112",1,"BLUE BUNNY ORIG BOMB POP 12PK/1.75 FL OZ",108,"OTHER"
"113",1,"BOMB POP HWN PNCH 12PK",31,"OTHER"
"114",1,"BREYER NAT LT CRMY VANILLA 48OZ",7,"OTHER"
"115",1,"BREYER NTRL CHRY VANILLA 56OZ",22,"OTHER"
"116",1,"BREYER NTRL FRCH VAN 56OZ",49,"OTHER"
"117",1,"BREYER VANILLA ICE CREAM 56OZ",88,"OTHER"
"118",1,"BREYERS BLASTS BDAY",19,"OTHER"
"119",1,"BREYERS CARB SMART CHOC",1,"OTHER"
"120",1,"BREYERS CARB SMART CHOC 48OZ",38,"OTHER"
"121",1,"BREYERS CO B GS THIN MINTS",20,"OTHER"
"122",1,"BREYERS CO BRAND M&MS",9,"OTHER"
"123",1,"BREYERS FAT FREE CRMY VAN 48OZ",9,"OTHER"
"124",1,"BREYERS LACTOSE FREE VAN 56OZ",47,"OTHER"
"125",1,"BREYERS NAT ROCKY ROAD 56OZ",28,"OTHER"
"126",1,"BREYERS NAT STRAWBERRY 56OZ",8,"OTHER"
"127",1,"BREYERS NSA VANILLA 48OZ",21,"OTHER"
"128",1,"BREYERS NTRL CHOC 48OZ",38,"OTHER"
"129",1,"BREYERS SNICKERS IC CRM 48OZ",47,"OTHER"
"130",1,"BREYERS WFL CONE W/HERSHEY CHOC CHP",36,"OTHER"
"131",1,"BRYER SMRT CARB VAN I/C 56OZ",47,"OTHER"
"132",1,"BRYERS OREO CHOC CKIE&CRM",18,"OTHER"
"133",1,"BRYRS CRBSMRT ALMD I/C BAR 6PK",86,"OTHER"
"134",1,"CADBURY CARAMELLO RED FAT IC BAR 12OZ",10,"OTHER"
"135",1,"CADBURY CHOC ALMD RED FAT IC BAR",4,"OTHER"
"136",1,"CIAO BELLA KEY LIME GRHM GEL SQ 3 OZ",21,"OTHER"
"137",1,"CLEMMYS IC CHOC CHIP",10,"OTHER"
"138",1,"CLEMMYS IC CHOCOLATE",7,"OTHER"
"139",1,"CLEMMYS IC TSTD ALMOND",1,"OTHER"
"140",1,"CLEMMYS IC VANILLA BEAN",11,"OTHER"
"141",1,"CLEMMYS SF IC BAR ORG CREAM",4,"OTHER"
"142",1,"COTTON CANDY BAR",29,"OTHER"
"143",1,"DAN OIKOS GRK FRZN YGRT CAFE LATTE",21,"OTHER"
"144",1,"DAN OIKOS GRK FRZN YGRT CHOC",24,"OTHER"
"145",1,"DAN OIKOS GRK FRZN YGRT KEY LIME",21,"OTHER"
"146",1,"DAN OIKOS GRK FRZN YGRT STRWBRY",15,"OTHER"
"147",1,"DIANA BANANAS BABIES DARK CHOC",51,"OTHER"
"148",1,"DIANAS BANABAS BABIES MILK CHOC",42,"OTHER"
"149",1,"DIANAS BANANAS BABIES MLK CHOC W/PNUT",21,"OTHER"
"150",1,"DREYER NSA SC VAN BEAN 48OZ",13,"OTHER"
"151",1,"DREYER'S REAL STRWBRRIES 48OZ",11,"OTHER"
"152",1,"DREYERS ASSORTED FRUIT BAR 12EA",95,"OTHER"
"153",1,"DREYERS BUTTER PECAN IC 48OZ",13,"OTHER"
"154",1,"DREYERS COOKIE DOUGH 48OZ",25,"OTHER"
"155",1,"DREYERS FRN VANILLA ICRM 48OZ",4,"OTHER"
"156",1,"DREYERS FRT BAR COCONUT 6CT",100,"OTHER"
"157",1,"DREYERS FRUIT BAR STRAW 6PK",127,"OTHER"
"158",1,"DREYERS LIGHT BUTTER PECAN 48OZ",36,"OTHER"
"159",1,"DREYERS LIGHT CHOCOLATE 48OZ",18,"OTHER"
"160",1,"DREYERS LIGHT FRENCH VAN 48OZ",20,"OTHER"
"161",1,"DREYERS LIGHT MINT 48OZ",23,"OTHER"
"162",1,"DREYERS LIGHT ROCKY ROAD 48OZ",36,"OTHER"
"163",1,"DREYERS LIGHT STRAWBERRY 48OZ",1,"OTHER"
"164",1,"DREYERS LIMITED EDITION 48OZ",16,"OTHER"
"165",1,"DREYERS LT CARM DELIGHT 48OZ",19,"OTHER"
"166",1,"DREYERS LT VANILLA 48OZ",40,"OTHER"
"167",1,"DREYERS MINT CHOC CHIP 48OZ",42,"OTHER"
"168",1,"DREYERS NEAPOLITAN 48OZ",17,"OTHER"
"169",1,"DREYERS NSA BUTTER PECAN 48OZ",35,"OTHER"
"170",1,"DREYERS NSA FDG TRACKS 48OZ",11,"OTHER"
"171",1,"DREYERS NSA VANILLA 48OZ",33,"OTHER"
"172",1,"DREYERS POMEGRANATE BARS",79,"OTHER"
"173",1,"DREYERS ROCKY ROAD ICRM 48OZ",9,"OTHER"
"174",1,"DREYERS VANILLA ICE CREAM 48OZ",34,"OTHER"
"175",1,"DREYERS YOG KEY LIME PIE",8,"OTHER"
"176",1,"DREYERS YOGURT FF VAN 48OZ",14,"OTHER"
"177",1,"DREYERS YOGURT VAN 48OZ",1,"OTHER"
"178",1,"DREYRS SC YOG CRML PRALINE",11,"OTHER"
"179",1,"DRUMSTICK NESTLE CRUNCH DPED",194,"OTHER"
"180",1,"DRUMSTICK VANILLA",70,"OTHER"
"181",1,"DRYERS SC MINT COOKIE CRNCH",7,"OTHER"
"182",1,"DRYRD FRUIT BAR NSA VARIETY 12CT",122,"OTHER"
"183",1,"DRYRS LOADED BUTTERFINGER 48OZ",21,"OTHER"
"184",1,"DRYRS LT S/CHRN FDG TRACKS 48OZ",6,"OTHER"
"185",1,"DRYRS LT S/CHRN LIMITED 48OZ",4,"OTHER"
"186",1,"DRYRS LT S/CHRN VAN BEAN 48OZ",25,"OTHER"
"187",1,"DRYRS SC YOG CAPPUCCINO CHP",4,"OTHER"
"188",1,"DRYRS SC YOG CHOC FDG BRWN",11,"OTHER"
"189",1,"ERTHBND FRM FRXN BRRY BSKT",91,"OTHER"
"190",1,"ERTHBND FRM FRZN BLBRRY",131,"OTHER"
"191",1,"ERTHBND FRM FRZN MNGO CHNK",52,"OTHER"
"192",1,"ESKIMO PIE NSA DARK CHOC",1,"OTHER"
"193",1,"FC PINEAPPLE SHERBET",2,"OTHER"
"194",1,"FREAL BL/RSP/POM SMOOTHIE 16OZ",12,"OTHER"
"195",1,"FREAL CAPPUCCINO COFFEE 16OZ",18,"OTHER"
"196",1,"FREAL FRZN CAPP COFFEE 16OZ",1,"OTHER"
"197",1,"FREAL MALT MILKSHAKE 16OZ",13,"OTHER"
"198",1,"FREAL MANGO SMOOTHIE 16OZ",13,"OTHER"
"199",1,"FREAL MILKSHAKE CHOC 16OZ",32,"OTHER"
"200",1,"FREAL MILKSHAKE CKIES N CRM 16OZ",91,"OTHER"
"201",1,"FREAL MILKSHAKE MINT CHIP 16OZ",8,"OTHER"
"202",1,"FREAL MILKSHAKE REESES 16OZ",72,"OTHER"
"203",1,"FREAL MILKSHAKE STRW 16OZ",12,"OTHER"
"204",1,"FREAL MILKSHAKE VAN 16OZ",32,"OTHER"
"205",1,"FREAL STRW/BAN SMOOTHIE 16OZ",17,"OTHER"
"206",1,"FRUITTARE FRT MILK BANANA",7,"OTHER"
"207",1,"FRUITTARE REAL FRT MANGO",14,"OTHER"
"208",1,"FRZN TALENTI GELATO SCLN PSTCHO",1,"OTHER"
"209",1,"GANDY I. CRM MOOSE TRACKS 64OZ",55,"OTHER"
"210",1,"GANDY I.CRM CARAMEL CARIBOU 64OZ",19,"OTHER"
"211",1,"GANDY I.CRM CHERRY VANILLA 64OZ",15,"OTHER"
"212",1,"GANDY I.CRM NEAPOLITAN 64OZ",17,"OTHER"
"213",1,"GANDY ICE CRM CHOCOLATE 64OZ",15,"OTHER"
"214",1,"GANDY ICE CRM VANILLA 64OZ",84,"OTHER"
"215",1,"GANDY SLIM & TRM VANILLA 64OZ",23,"OTHER"
"216",1,"GANDYS VANILLA ICE CREAM 4QT 128OZ",132,"OTHER"
"217",1,"GELATO CRML TFFEE CRNCH",2,"OTHER"
"218",1,"GELATO EXPRSSO CPPCCNO CR",3,"OTHER"
"219",1,"GELATO ROMAN CRM SWRL",2,"OTHER"
"220",1,"GELATO TIRAMISU CHOC CFFE",7,"OTHER"
"221",1,"HAAGEN DAZ CUP CHOC PNUT BTTR",133,"OTHER"
"222",1,"HAAGEN DAZ VAN YOGURT 14OZ",18,"OTHER"
"223",1,"HAAGEN DAZS BAR SLTD CRML",12,"OTHER"
"224",1,"HAAGEN DAZS BTR PECAN 14OZ",45,"OTHER"
"225",1,"HAAGEN DAZS CHOC ICE CREAM 14OZ",75,"OTHER"
"226",1,"HAAGEN DAZS CHOC PNUT BTTR",32,"OTHER"
"227",1,"HAAGEN DAZS COFFEE IC 14OZ",70,"OTHER"
"228",1,"HAAGEN DAZS CUP CHOCOLATE",72,"OTHER"
"229",1,"HAAGEN DAZS CUP COFFEE",171,"OTHER"
"230",1,"HAAGEN DAZS CUP VANILLA",144,"OTHER"
"231",1,"HAAGEN DAZS GELATO BLK CHRRY AMRTO",28,"OTHER"
"232",1,"HAAGEN DAZS GELATO CAPPUCCINO",25,"OTHER"
"233",1,"HAAGEN DAZS GELATO CUP SEA SLT CRML",6,"OTHER"
"234",1,"HAAGEN DAZS GELATO CUP VAN BEAN",25,"OTHER"
"235",1,"HAAGEN DAZS GELATO DRK CHOC CHP",34,"OTHER"
"236",1,"HAAGEN DAZS GELATO LIMONCELLO",26,"OTHER"
"237",1,"HAAGEN DAZS GELATO SEA SALT CRML",32,"OTHER"
"238",1,"HAAGEN DAZS GELATO STRACCIATELL",24,"OTHER"
"239",1,"HAAGEN DAZS GELATO VAN BEAN",10,"OTHER"
"240",1,"HAAGEN DAZS RUM RAISIN 14OZ",32,"OTHER"
"241",1,"HAAGEN-DAZ VAN BEAN 14OZ",24,"OTHER"
"242",1,"HAG DAZ VANILLA 28OZ",52,"OTHER"
"243",1,"HAGEN DAZ CHOCOLATE 28OZ",38,"OTHER"
"244",1,"HAGEN DAZ COFFEE 28OZ",68,"OTHER"
"245",1,"HAGEN DAZ STWBRRY IC 14OZ",32,"OTHER"
"246",1,"HAGEN DAZ VANILLA ICE CREAM 14OZ",48,"OTHER"
"247",1,"HAGEN DAZS CHOC CHOC CHP 14OZ",32,"OTHER"
"248",1,"HAGEN DAZS VAN SWSS ALMD 14OZ",40,"OTHER"
"249",1,"HD CARAMEL CONE CUP",35,"OTHER"
"250",1,"HD COFFEE & ALMOND CRUNCH",32,"OTHER"
"251",1,"HD SNACK VAN & ALMND",43,"OTHER"
"252",1,"HD VAN CHOC PNUT BTR BAR",8,"OTHER"
"253",1,"HGN DAZS CUP DULC DE LECHE",52,"OTHER"
"254",1,"IMAGINE ALMND DREAM CAPP SWRL",35,"OTHER"
"255",1,"JLLY LLMA SORBET 4SQZ PNAPLE",1,"OTHER"
"256",1,"JOLLY LLAMA SORBET 45QZUP BAN CCNUT",4,"OTHER"
"257",1,"JOLLY LLAMA SORBET 45QZUP MANGO",4,"OTHER"
"258",1,"JOLLY LLAMA SORBET 45QZUP RSPBRY",2,"OTHER"
"259",1,"JOLLY LLAMA SORBET 45QZUP STRAWBERRY",2,"OTHER"
"260",1,"JULIES BLACKBERRY SORBET BAR 4CT",3,"OTHER"
"261",1,"JULIES FUDGE BAR 4CT",5,"OTHER"
"262",1,"JULIES ICRM SANDWICH 3OZ",17,"OTHER"
"263",1,"KEMPS FF CHOC FRZN YOG",78,"OTHER"
"264",1,"KEMPS FF CRML PRALINE FRZN YOG 48OZ",102,"OTHER"
"265",1,"KEMPS FF NSA VAN YOG",83,"OTHER"
"266",1,"KEMPS FF STRWBRY FRZN YOG 48OZ",73,"OTHER"
"267",1,"KEMPS FF VAN FRZN YOG 48OZ",59,"OTHER"
"268",1,"KEMPS FRZ YGRT VANILLA 56OZ",1,"OTHER"
"269",1,"KEMPS LF BLK JCK CHRY YOG",84,"OTHER"
"270",1,"KEMPS LF CHOC ALMND",55,"OTHER"
"271",1,"KEMPS LF CRML BROWNIE YOG",68,"OTHER"
"272",1,"KEMPS LF MOOSE TRKS YOG",65,"OTHER"
"273",1,"KEMPS LF VAN BEAN YOG",119,"OTHER"
"274",1,"KLONDIKE HEATH BAR 6PK 4,5OZ",53,"OTHER"
"275",1,"KLONDIKE MINT CHOC CHIP",49,"OTHER"
"276",1,"KLONDIKE ORIGINAL VAN 6PK 4,5OZ",110,"OTHER"
"277",1,"KLONDIKE RED FAT NSA 6EA",49,"OTHER"
"278",1,"KLONDIKE VANILLA SANDWICH",79,"OTHER"
"279",1,"LIFEWAY KEFIR TT MANGO",24,"OTHER"
"280",1,"LIFEWAY KEFIR TT ORIGINAL",8,"OTHER"
"281",1,"LIFEWAY KEFIR TT PMGRANT",17,"OTHER"
"282",1,"LIFEWAY KEFIR TT STRWBRY",18,"OTHER"
"283",1,"LUIGIS ITAL ICE VARTY PK",92,"OTHER"
"284",1,"LUIGIS ITALIAN ICE CHERRY",75,"OTHER"
"285",1,"LUIGIS ITALIAN ICE NS VRTY",40,"OTHER"
"286",1,"M/MAID SFT FRZN LEMONADE",47,"OTHER"
"287",1,"M/MAID SFT FRZN LIMEADE",51,"OTHER"
"288",1,"MAGNOLIA ICE CREAM CCNUT",24,"OTHER"
"289",1,"MAGNOLIA ICE CREAM TRPCL AVCDO",35,"OTHER"
"290",1,"MAGNOLIA ICE CREAM TRPCL UBE",36,"OTHER"
"291",1,"MAGNUM DBL CARAMEL IC BARS",114,"OTHER"
"292",1,"MAGNUM DBL CARAMEL ICE CRM BARS",1,"OTHER"
"293",1,"MAGNUM GOLD 3PK",44,"OTHER"
"294",1,"MINUTE MAID JUICE BARS",37,"OTHER"
"295",1,"MOUNDS ICRM BARS 6CT",16,"OTHER"
"296",1,"NE CLASSIC DRMSTICK COMBO 8CT",209,"OTHER"
"297",1,"NE CLASSIC DRMSTK VNLLA 8EA",264,"OTHER"
"298",1,"NESTLE LIL DRUM CHOC SWIRL",55,"OTHER"
"299",1,"OSD ND CHOC VELVET OG 32OZ",9,"OTHER"
"300",1,"OSD ND CREAMY VANILLA OG 32OZ",23,"OTHER"
"301",1,"OSD ND NEOPOLITAN 32OZ",10,"OTHER"
"302",1,"POPSICLE FIRECRACKER JR",60,"OTHER"
"303",1,"POPSICLE FUDGSICLE NSA",157,"OTHER"
"304",1,"POPSICLE JLY RNCHR AWESOME TWOSOME",1,"OTHER"
"305",1,"POPSICLE JOLLY RANCHER 20PK",48,"OTHER"
"306",1,"POPSICLE OR/GR/CHRY 24EA",136,"OTHER"
"307",1,"POPSICLE S/F OR/CH/GR 24PK",152,"OTHER"
"308",1,"POPSICLE SCRIBBLERS 24EA",48,"OTHER"
"309",1,"POPSICLE SF ORG/CHRY/GRP",83,"OTHER"
"310",1,"POPSICLE SF TROPICALS 24PK",93,"OTHER"
"311",1,"POPSICLE SOUR PATCH 18CT",33,"OTHER"
"312",1,"RDRM VANILLA 16OZ",17,"OTHER"
"313",1,"REESE'S ICE CREAM CUP",56,"OTHER"
"314",1,"RICE DRM BITES VAN 6.6 OZ",13,"OTHER"
"315",1,"RSH BWL MEAL IN A BWL ENGRY",1,"OTHER"
"316",1,"RSH BWL MEAL IN A BWL OASIS",10,"OTHER"
"317",1,"RSH BWL MEAL IN A BWL PWR",8,"OTHER"
"318",1,"RSH BWL MEAL IN A BWL YOGA",9,"OTHER"
"319",1,"RSH BWL ML IN A BWL ACAI GF",7,"OTHER"
"320",1,"S COW TRUFFLE BAR CRML",63,"OTHER"
"321",1,"S.COW CHOC.VAN SANDWICH 3CT",76,"OTHER"
"322",1,"S/COW NSA VANILLA SANDWICH 6CT",72,"OTHER"
"323",1,"SCOOPS BANANA NUT 64OZ",18,"OTHER"
"324",1,"SCOOPS BUTTER PECAN 64OZ",33,"OTHER"
"325",1,"SCOOPS CHOCOLATE 64OZ",42,"OTHER"
"326",1,"SCOOPS CHOCOLATE CHIP 64OZ",40,"OTHER"
"327",1,"SCOOPS COOKIES & CREAM 64OZ",44,"OTHER"
"328",1,"SCOOPS LOWFAT CHOCOLATE 64OZ",6,"OTHER"
"329",1,"SCOOPS LOWFAT VANILLA 64OZ",3,"OTHER"
"330",1,"SCOOPS MUDSLIDE COFFEE I/C 64OZ",33,"OTHER"
"331",1,"SCOOPS NEOPOLITAN 64OZ",28,"OTHER"
"332",1,"SCOOPS ROCKY ROAD 64OZ",30,"OTHER"
"333",1,"SCOOPS STRAWBERRY 64OZ",15,"OTHER"
"334",1,"SCOOPS TSTD ALMOND FUDGE 64OZ",76,"OTHER"
"335",1,"SCOOPS VANILLA 64OZ",159,"OTHER"
"336",1,"SCOOPS VANILLA FUDGE 64OZ",27,"OTHER"
"337",1,"SK ICE CRM SAND LF VAN 6EA",107,"OTHER"
"338",1,"SKINNY COW COOKIES & CRM",81,"OTHER"
"339",1,"SKINNY COW FUDGE BAR",51,"OTHER"
"340",1,"SLIM A BEAR 100CAL VAN BAR 2OZ",91,"OTHER"
"341",1,"SLIM ABEAR 100CA TOFF/FRVAN 8CT",80,"OTHER"
"342",1,"SNICKERS ICE CRM BARS",105,"OTHER"
"343",1,"SO DEL BAR CNUT ICRM ALM",33,"OTHER"
"344",1,"SO DEL CNUT BAN SPLT MINI SNDW",12,"OTHER"
"345",1,"SO DEL COCNT CHOC ICRM",26,"OTHER"
"346",1,"SO DEL COCONT CKY DGH",25,"OTHER"
"347",1,"SO DEL COCONT MLK ICRM",10,"OTHER"
"348",1,"SO DEL COCONT MOCHA",23,"OTHER"
"349",1,"SO DEL COCONT VAN",26,"OTHER"
"350",1,"SO DELICIO SYICRM MIN SAN VAN 2,3OZ",25,"OTHER"
"351",1,"SORBETTO BLOOD ORANGE",4,"OTHER"
"352",1,"SORBETTO LEMON",9,"OTHER"
"353",1,"SOUR POP GREEN APPLE",29,"OTHER"
"354",1,"SOY DELC CHOC OBESSN OG2 16OZ",12,"OTHER"
"355",1,"STNYFLD FRZN YOG DRK CHOC 16OZ",22,"OTHER"
"356",1,"STNYFLD LF MNT CHO YGRT OG2 16OZ",15,"OTHER"
"357",1,"STNYFLD NF VAN FDG YGRT OG2 16OZ",15,"OTHER"
"358",1,"STNYFLD NF VAN YOGRT OG2 16OZ",10,"OTHER"
"359",1,"STNYFLD YGRT FRZ FF BLUBRY",12,"OTHER"
"360",1,"STONYFIELD YGRT FRZ FF CHOC",22,"OTHER"
"361",1,"STONYFIELD YGRT FRZ FF HONEY",7,"OTHER"
"362",1,"STONYFIELD YGRT FRZ FF VANILLA",23,"OTHER"
"363",1,"STONYFIELD YOGURT FRZ NF BAR VAN W/CHOC",13,"OTHER"
"364",1,"SWT FRDM VAN ICRM CONE 6CT",29,"OTHER"
"365",1,"SYDRM BUTTER PECAN 16OZ",26,"OTHER"
"366",1,"TALENTI BLOOD ORANGE",1,"OTHER"
"367",1,"TALENTI BLOOD ORANGE SORBETTO 16OZ",33,"OTHER"
"368",1,"TALENTI GELATO CARAMEL COOKIE CRUNCH",106,"OTHER"
"369",1,"TALENTI GELATO CARIBBEAN COCONUT 16OZ",79,"OTHER"
"370",1,"TALENTI GELATO CH/PNT BTR CUP",122,"OTHER"
"371",1,"TALENTI GELATO COOKIE",1,"OTHER"
"372",1,"TALENTI GELATO CRRBN COCNT",1,"OTHER"
"373",1,"TALENTI GELATO CRRBN COCNT 16OZ",1,"OTHER"
"374",1,"TALENTI GELATO DBL DRK CHOC",1,"OTHER"
"375",1,"TALENTI GELATO DOUBLE DARK CHOC",89,"OTHER"
"376",1,"TALENTI GELATO MILK CHOC",120,"OTHER"
"377",1,"TALENTI GELATO MILK CHOC 16OZ",1,"OTHER"
"378",1,"TALENTI GELATO PISTACHIO",100,"OTHER"
"379",1,"TALENTI GELATO RMN RSPBRY",1,"OTHER"
"380",1,"TALENTI GELATO ROMAN RASPBERRY SORBETTO",86,"OTHER"
"381",1,"TALENTI GELATO SCLN PSTCHO",1,"OTHER"
"382",1,"TALENTI GELATO SEA SALT",77,"OTHER"
"383",1,"TALENTI GELATO TAHITIAN VANILLA BEAN 16OZ",85,"OTHER"
"384",1,"TALENTI GELATO VANILLA BEAN",1,"OTHER"
"385",1,"TALENTI GELATO VANILLA BEAN 16OZ",1,"OTHER"
"386",1,"TOFUTTI CUTIES CHOCOLATE",4,"OTHER"
"387",1,"TOFUTTI CUTIES MNT CHOC 8CT",2,"OTHER"
"388",1,"TOFUTTI CUTIES VANILLA 8CT",4,"OTHER"
"389",1,"VT CHOC ICRM LITE",2,"OTHER"
"390",1,"VT FUDGE SWIRL ICRM LITE",9,"OTHER"
"391",1,"VT NEAPOLITAN ICRM LITE",1,"OTHER"
"392",1,"VT STRWBRY ICRM LITE",6,"OTHER"
"393",1,"WW BLACK CHERRY SWIRL GREEK FRZN YOG CUPS 12OZ",22,"OTHER"
"394",1,"WW BLBRY SWRL BARS 6PK",71,"OTHER"
"395",1,"WW CANDY BARS 6/2 FL OZ",86,"OTHER"
"396",1,"WW CHOC SMTH BARS 12CT",25,"OTHER"
"397",1,"WW CKIES&CRM BARS",41,"OTHER"
"398",1,"WW DARK CHOCOLATE RASPBERRY BARS 12PK",72,"OTHER"
"399",1,"WW DIVINE TRIPLE CHOCOLATE BARS",34,"OTHER"
"400",1,"WW DRK CHOC RSPB BARS",1,"OTHER"
"401",1,"WW ENGLSH TFEE CRCH BAR 12CT",139,"OTHER"
"402",1,"WW GIANT CHOC FUDGE BAR 24OZ",159,"OTHER"
"403",1,"WW GIANT LATTE BAR 6PK",39,"OTHER"
"404",1,"WW LOW FAT ICECREAM CHOC FUDGE BROWNIE CUPS 12OZ",37,"OTHER"
"405",1,"WW LOW FAT ICECREAM MINT CHIP CUPS 12OZ",28,"OTHER"
"406",1,"WW PCH SWIRL BARS 6PK",44,"OTHER"
"407",1,"WW SNACK SIZE VAN FUDGE SWRL CONES",50,"OTHER"
"408",1,"WW SNCK SZ RD VELVET 8PK",17,"OTHER"
"409",1,"WW SNK SZ CHOC FDG BARS",96,"OTHER"
"410",1,"WW SNK SZ VP ICE CRM SNDWCH",19,"OTHER"
"411",1,"WW STRAWBERRY SMOOTHIE BARS",48,"OTHER"
"412",1,"WW STRAWBERRY SWIRL GREEK FRZN YOG CUPS 12OZ",14,"OTHER"
"413",1,"WW STRW SMOOTHIE BARS",1,"OTHER"
"414",1,"WW VAN RND ICE CRM SNDWCH 24OZ",63,"OTHER"
"415",1,"YASSO BLBRY BAR 4PK",19,"OTHER"
"416",1,"YASSO COCONUT BAR 4PK",35,"OTHER"
"417",1,"YASSO MANGO BAR 4PK",12,"OTHER"
"418",1,"YASSO RASP BAR 4PK",31,"OTHER"
"419",1,"YASSO STRW BAR 4PK",18,"OTHER"
"420",1,"YORK PEPPERMINT ICRM PATTY 6CT",19,"OTHER"
"421",2,"*CV*DIPPIN DOTS BAN SPLIT",92,"OTHER"
"422",2,"*CV*DIPPIN DOTS BIRTHDAY CAKE",10,"OTHER"
"423",2,"*CV*DIPPIN DOTS CHOC",69,"OTHER"
"424",2,"*CV*DIPPIN DOTS CKIE DGH",52,"OTHER"
"425",2,"*CV*DIPPIN DOTS CKIES/CRM",36,"OTHER"
"426",2,"*CV*DIPPIN DOTS COTTON CANDY",1,"OTHER"
"427",2,"*CV*DIPPIN DOTS ICE RNBW",96,"OTHER"
"428",2,"*CV*DIPPIN DOTS MINT CHOC",59,"OTHER"
"429",2,"*CV*DIPPIN DOTS STRAWBERRY",31,"OTHER"
"430",2,"*CV*DIPPIN DOTS VAN ICE CRM",61,"OTHER"
"431",2,"*D* CLEMMYS IC COFFEE",5,"OTHER"
"432",2,"*D*B&JS COLBERT AMERICONE DRM 16OZ",1,"OTHER"
"433",2,"*D*HD CHOCOLATE CUP 24PK",1,"OTHER"
"434",2,"*D*HD DULCE DE LECHE CUP 24PK",1,"OTHER"
"435",2,"*D*HD VANILLA CUP 24PK",1,"OTHER"
"436",2,"*D*TALENTI GELATO MILK CHOC",1,"OTHER"
"437",2,"*R* DREYERS FRT BAR LIME 6CT",67,"OTHER"
"438",2,"*R* HD DULCE DE LECHE CARAMEL 14OZ",48,"OTHER"
"439",2,"*S*KEMP'S CANDY CANE ICECREAM",12,"OTHER"
"440",2,"*S*KEMP'S CINNAMON ICECREAM",13,"OTHER"
"441",2,"*S*KEMP'S HOLIDAY VANILLA ICECREAM",9,"OTHER"
"442",2,"*S*KEMP'S PUMPKIN PIE ICECREAM",29,"OTHER"
"443",2,"ALDENS ICE CREAM CHOC CHP 48OZ",8,"OTHER"
"444",2,"ALDENS ICE CREAM CKIE CRM 48OZ",4,"OTHER"
"445",2,"ALDENS ICE CREAM VANILLA 48OZ",34,"OTHER"
"446",2,"ALDENS ICRM MINT CHIP OG2 48OZ",4,"OTHER"
"447",2,"ALMD DRM BITES VAN 6.6 OZ",11,"OTHER"
"448",2,"ALMD DRM CHOCOLATE FROZN 16 OZ",19,"OTHER"
"449",2,"ALMD DRM PRALINE CRNCH 16OZ",62,"OTHER"
"450",2,"ALMD DRM VANILLA FROZL 16 OZ",3,"OTHER"
"451",2,"ARTIC ZERO ICE CRM CHOC",27,"OTHER"
"452",2,"ARTIC ZERO ICE CRM CHOC PNUT BTTR",33,"OTHER"
"453",2,"ARTIC ZERO ICE CRM COFFEE",32,"OTHER"
"454",2,"ARTIC ZERO ICE CRM COOKIE N CRM",34,"OTHER"
"455",2,"ARTIC ZERO ICE CRM MINT CHOC CKY",23,"OTHER"
"456",2,"ARTIC ZERO ICE CRM VANILLA",49,"OTHER"
"457",2,"B BELL ASST FRZN YOGURT HG 64OZ",81,"OTHER"
"458",2,"B BELL ASST GOLD ICE CRM HG 64OZ",4630,"OTHER"
"459",2,"B BELL BROWN RIM I/CREAM HG 64OZ",1493,"OTHER"
"460",2,"B BELL LIGHT I/CREAM HG 64OZ",165,"OTHER"
"461",2,"B BELL NO SUGAR ADDED HG 64OZ",258,"OTHER"
"462",2,"B&J BAN P/BTR GRK YOG",28,"OTHER"
"463",2,"B&J BLBRY VAN GRHM GRK YOG",15,"OTHER"
"464",2,"B&J CHEESECAKE BROWNIE 16OZ",61,"OTHER"
"465",2,"B&J CHERRY GARCIA 16OZ",101,"OTHER"
"466",2,"B&J CHERRY GARCIA CUP 12PK",130,"OTHER"
"467",2,"B&J CHOC FDG BROWNIE 16OZ",123,"OTHER"
"468",2,"B&J CHOC FDG BROWNIE CUP 12PK",35,"OTHER"
"469",2,"B&J CHOCC CHP COOKIE DOUGH 16OZ",68,"OTHER"
"470",2,"B&J CHUNKEY MONKEY 16OZ",55,"OTHER"
"471",2,"B&J CINNAMON BUNS 16OZ",67,"OTHER"
"472",2,"B&J COFFEE BUZZ",45,"OTHER"
"473",2,"B&J COFFEE W/HEATH 16OZ",72,"OTHER"
"474",2,"B&J COOKIE DOUGH CUP 12PK",227,"OTHER"
"475",2,"B&J FY CHERRY GARCIA",46,"OTHER"
"476",2,"B&J KARAMEL SUTRA 16OZ",63,"OTHER"
"477",2,"B&J LMN BLBRY GRK YOG",1,"OTHER"
"478",2,"B&J MILK & COOKIES",91,"OTHER"
"479",2,"B&J NEW YORK SUPER FUDGE 16OZ",31,"OTHER"
"480",2,"B&J PEANUT BUTTER CUP 16OZ",41,"OTHER"
"481",2,"B&J PHISH FOOD PT 16OZ",96,"OTHER"
"482",2,"B&J RASP FDG CHNK GRK YOG",16,"OTHER"
"483",2,"B&J RED VELVET CAKE ICE CRM",52,"OTHER"
"484",2,"B&J STEPHEN COLBERTS AMERICONE DREAM",95,"OTHER"
"485",2,"B&J STRW SHRCK GRK YOG",11,"OTHER"
"486",2,"B&J VANILLA",17,"OTHER"
"487",2,"B&J YOGURT CHERRY GARCIA",1,"OTHER"
"488",2,"B.BELL FUDGE BARS 12EA",584,"OTHER"
"489",2,"B/BNY SWEET FREEDOM VAN SNACK SIZE CONES",45,"OTHER"
"490",2,"BB ALMOND BAR SINGLE 1EA",12,"OTHER"
"491",2,"BB BANANA FUDGE BAR",333,"OTHER"
"492",2,"BB BDAY PARTY SNDWCH 8PK",30,"OTHER"
"493",2,"BB BULLETS 24EA",170,"OTHER"
"494",2,"BB CHAMP VAR PK CONES",32,"OTHER"
"495",2,"BB CHOC & VAN CUPS 12EA",265,"OTHER"
"496",2,"BB CHOC CHIP COOKIE SINGLE 5,25OZ",140,"OTHER"
"497",2,"BB CHOC CHRY BARS 12PK",39,"OTHER"
"498",2,"BB CHOC FUDGE BAR",82,"OTHER"
"499",2,"BB CKS/CREAM SANDWICH SINGLE 1EA",235,"OTHER"
"500",2,"BB CNTRY CONE CKS/CRM SGL 1EA",174,"OTHER"
"501",2,"BB CNTRY CONE VANILLA SINGLE 1EA",185,"OTHER"
"502",2,"BB CREME POPS 24EA",52,"OTHER"
"503",2,"BB DIPPED COCONUT FRT BARS",103,"OTHER"
"504",2,"BB FUDGE BOMBSTIK SINGLE 1EA",350,"OTHER"
"505",2,"BB GREAT DIVIDE SINGLES 1EA",29,"OTHER"
"506",2,"BB HOMEMADE VANILLA CUP SGL 1EA",154,"OTHER"
"507",2,"BB ICE CREAM SANDWICH 12EA",187,"OTHER"
"508",2,"BB ICE CREAM SANDWICH SINGLE 1EA",213,"OTHER"
"509",2,"BB KRUNCH BAR SINGLE 1EA",63,"OTHER"
"510",2,"BB LIME FRUIT BAR SNGLE",5,"OTHER"
"511",2,"BB MINI SANDWICH 24EA",151,"OTHER"
"512",2,"BB MINI SWIRL CRML CONES 18OZ",35,"OTHER"
"513",2,"BB MINT CCHIP BARS",72,"OTHER"
"514",2,"BB MIXED BERRIES FRT BARS",151,"OTHER"
"515",2,"BB NEAO SANDWICH SINGLE 5,75OZ",131,"OTHER"
"516",2,"BB NSA MOOO BARS 12EA",92,"OTHER"
"517",2,"BB RAINBOW FREEZE SINGLE 1EA",153,"OTHER"
"518",2,"BB RAINBOW POP UPS SINGLE 1EA",101,"OTHER"
"519",2,"BB SMPLY VAN SNCWCH 8PK",45,"OTHER"
"520",2,"BB STRW FRUIT BARS",395,"OTHER"
"521",2,"BB SUNDAE CUPS",81,"OTHER"
"522",2,"BB TRPL DLGHT SNDWCH 8PK",39,"OTHER"
"523",2,"BBNY CARAMEL KRUNCH BARS 12EA",34,"OTHER"
"524",2,"BBNY CHAMP CONE VAN 6EA",45,"OTHER"
"525",2,"BBNY FUDGE BARS 12EA",11,"OTHER"
"526",2,"BBNY SWT FRDM IC LITES 12EA",46,"OTHER"
"527",2,"BBNY SWT FRDM KRNCH LT 12EA",48,"OTHER"
"528",2,"BBUNNY SWT FRDM FDG LT 12PK 12EA",47,"OTHER"
"529",2,"BJ SMORES 16OZ",51,"OTHER"
