"","Month","LongDes","TotItemQty","Brand"
"6413",14,"HD SNACK VAN & ALMND",88,"OTHER"
"6414",14,"HGN DAZS CUP DULC DE LECHE",422,"OTHER"
"6415",14,"HGN DZS GLT BR TRMS DC 3OZ",13,"OTHER"
"6416",14,"HGN DZS GLT BR VNL CRM PZL 3OZ",25,"OTHER"
"6417",14,"JLLY LLMA SORBET 4SQZ PNAPLE",16,"OTHER"
"6418",14,"JOLLY LLAMA SORBET 45QZUP BAN CCNUT",4,"OTHER"
"6419",14,"JOLLY LLAMA SORBET 45QZUP MANGO",7,"OTHER"
"6420",14,"JOLLY LLAMA SORBET 45QZUP RSPBRY",13,"OTHER"
"6421",14,"JOLLY LLAMA SORBET 45QZUP STRWBRY",11,"OTHER"
"6422",14,"JULIES ICRM SANDWICH",22,"OTHER"
"6423",14,"KEMPS FF CHOC FRZN YOG",74,"OTHER"
"6424",14,"KEMPS FF CRML PRALINE YOG",56,"OTHER"
"6425",14,"KEMPS FF NSA VAN YOG",104,"OTHER"
"6426",14,"KEMPS FF STRW FRZN YOG",156,"OTHER"
"6427",14,"KEMPS FF VAN FRZN YOG",80,"OTHER"
"6428",14,"KEMPS LF BLK JCK CHRY YOG",105,"OTHER"
"6429",14,"KEMPS LF BTTR PECAN YOG",74,"OTHER"
"6430",14,"KEMPS LF CHOC ALMND",83,"OTHER"
"6431",14,"KEMPS LF CRML BROWNIE YOG",74,"OTHER"
"6432",14,"KEMPS LF MOOSE TRKS YOG",140,"OTHER"
"6433",14,"KEMPS LF SEA SALT CRML YOG",90,"OTHER"
"6434",14,"KEMPS LF VAN BEAN YOG",135,"OTHER"
"6435",14,"KLNDK CKS CRM KANDY BAR",61,"OTHER"
"6436",14,"KLNDK CRML PNUT KANDY BAR",82,"OTHER"
"6437",14,"KLNDK FDGE CRNCH KANDY BR",25,"OTHER"
"6438",14,"KLONDIKE HEATH BAR",130,"OTHER"
"6439",14,"KLONDIKE KANDY KARAMEL BAR",19,"OTHER"
"6440",14,"KLONDIKE MINT CHOC CHIP",92,"OTHER"
"6441",14,"KLONDIKE ORIGINAL ICE CREAM BAR",11,"OTHER"
"6442",14,"KLONDIKE ORIGINAL VAN",216,"OTHER"
"6443",14,"KLONDIKE RED FAT NSA",116,"OTHER"
"6444",14,"KLONDIKE VANILLA SANDWICH",408,"OTHER"
"6445",14,"LCN BDAY CAKE ICRM SNDWCH",123,"OTHER"
"6446",14,"LCN BIRTHDAY CAKE ICECRM",57,"OTHER"
"6447",14,"LCN BIRTHDAY CAKE ICRM",78,"OTHER"
"6448",14,"LCN CHOC MARBLE ICECREAM",95,"OTHER"
"6449",14,"LCN CHOC MNT ICRM SNDWCH",78,"OTHER"
"6450",14,"LCN CHOC SUNDAE CUPS",185,"OTHER"
"6451",14,"LCN CHOCOLATE ICECREAM",124,"OTHER"
"6452",14,"LCN CHOCOLATE ICRM",88,"OTHER"
"6453",14,"LCN CKIES N CRM IC SNDWCH",230,"OTHER"
"6454",14,"LCN CKIES N CRM ICECREAM",121,"OTHER"
"6455",14,"LCN CKIES N CRM ICRM",103,"OTHER"
"6456",14,"LCN FF CH CHIP BLK CHRY FY",44,"OTHER"
"6457",14,"LCN FF CHOC FRZN YOGURT",39,"OTHER"
"6458",14,"LCN FF VAN FRZN YOGURT",42,"OTHER"
"6459",14,"LCN FUDGE BARS VALUE PACK",44,"OTHER"
"6460",14,"LCN KEY LIME SHERBET",81,"OTHER"
"6461",14,"LCN KRUNCH BARS",242,"OTHER"
"6462",14,"LCN LF CKIES N CRM ICRM",91,"OTHER"
"6463",14,"LCN LF MINT CHOC CHIP ICRM",60,"OTHER"
"6464",14,"LCN LF VANILLA ICECREAM",134,"OTHER"
"6465",14,"LCN MNT CHOC CHP ICRM",87,"OTHER"
"6466",14,"LCN NEAPOLITAN ICECREAM",185,"OTHER"
"6467",14,"LCN NEAPOLITAN ICRM",63,"OTHER"
"6468",14,"LCN NEAPOLTIN ICRM SNDWCH",174,"OTHER"
"6469",14,"LCN ORANGE BARS",286,"OTHER"
"6470",14,"LCN PINEAPPLE SHERBET",98,"OTHER"
"6471",14,"LCN RAINBOW SHERBET",174,"OTHER"
"6472",14,"LCN ROCKY ROAD ICECREAM",77,"OTHER"
"6473",14,"LCN RT BEER FLOAT BARS",166,"OTHER"
"6474",14,"LCN STRAWBERRY IC",40,"OTHER"
"6475",14,"LCN STRWBRY SUNDAE CUPS",136,"OTHER"
"6476",14,"LCN TOFFEE BRITTLE BARS",173,"OTHER"
"6477",14,"LCN VAN ICECREAM SNDWCH",417,"OTHER"
"6478",14,"LCN VAN ICRM SNDWCH",497,"OTHER"
"6479",14,"LCN VAN ORANGE SHERBET",44,"OTHER"
"6480",14,"LCN VANILLA ICECREAM",360,"OTHER"
"6481",14,"LCN VANILLA ICREAM",189,"OTHER"
"6482",14,"LIFEWAY KEFIR TT MANGO",56,"OTHER"
"6483",14,"LIFEWAY KEFIR TT ORIGINAL",15,"OTHER"
"6484",14,"LIFEWAY KEFIR TT PMGRANT",33,"OTHER"
"6485",14,"LIFEWAY KEFIR TT STRWBRY",22,"OTHER"
"6486",14,"LUIGI'S CHC ITN ICE",12,"OTHER"
"6487",14,"LUIGIS ITAL ICE VARTY PK",54,"OTHER"
"6488",14,"LUIGIS ITALIAN ICE CHERRY",95,"OTHER"
"6489",14,"LUIGIS ITALIAN ICE NS VRTY",45,"OTHER"
"6490",14,"M/MAID SFT FRZN LEMONADE",64,"OTHER"
"6491",14,"M/MAID SFT FRZN LIMEADE",62,"OTHER"
"6492",14,"MAGNOLIA ICE CREAM CCNUT",21,"OTHER"
"6493",14,"MAGNOLIA ICE CREAM TRPCL AVCDO",26,"OTHER"
"6494",14,"MAGNOLIA ICE CREAM TRPCL UBE",32,"OTHER"
"6495",14,"MAGNUM DBL CRML IC BARS",324,"OTHER"
"6496",14,"MAGNUM DBLE PB BAR",3,"OTHER"
"6497",14,"MAGNUM GOLD 3PK",66,"OTHER"
"6498",14,"MGNM MINI ALMND WHT VRTY",145,"OTHER"
"6499",14,"MONSTER COOKIE  ORIGINAL",2,"OTHER"
"6500",14,"MONSTER COOKIE CHOCOLOT",2,"OTHER"
"6501",14,"MONSTER MUNCH POLAR BEAR POOP",2,"OTHER"
"6502",14,"MONSTER MUNCH SPECKLED SLIME",2,"OTHER"
"6503",14,"MONSTER MUNCH T REX ROX",6,"OTHER"
"6504",14,"MRS FIELDS COOKIE SANDWICH",20,"OTHER"
"6505",14,"NE CLASSIC DRMSTICK COMBO",270,"OTHER"
"6506",14,"NE CLASSIC DRMSTK VNLLA",409,"OTHER"
"6507",14,"NESTLE LIL DRUM CHOC SWIRL",114,"OTHER"
"6508",14,"ON BLBRY GREEK YOG BARS",91,"OTHER"
"6509",14,"ON BLUBRY GRK FRZN YOG",9,"OTHER"
"6510",14,"ON CHRY GREEK YOG BARS",67,"OTHER"
"6511",14,"ON CHRY GRK FRZN YOG",10,"OTHER"
"6512",14,"ON MNGO GRK FRZN YOG",19,"OTHER"
"6513",14,"ON MXD BRY FRUIT VEG BARS",76,"OTHER"
"6514",14,"ON ORNG MNG FRT VEG BARS",26,"OTHER"
"6515",14,"ON PEACH FRUIT VEG BARS",23,"OTHER"
"6516",14,"ON PEACH GRK FRZN YOG",22,"OTHER"
"6517",14,"ON STRW FRUIT VEG BARS",57,"OTHER"
"6518",14,"ON STRW GREEK YOG BARS",60,"OTHER"
"6519",14,"ON STRW GRK FRZN YOG",14,"OTHER"
"6520",14,"ON VAN GREEK YOG BARS",54,"OTHER"
"6521",14,"ON VAN GRK FRZN YOG",22,"OTHER"
"6522",14,"OSD ND CHOC VELVET OG",12,"OTHER"
"6523",14,"OSD ND CREAMY VANILLA OG",17,"OTHER"
"6524",14,"OSD ND NEOPOLITAN",17,"OTHER"
"6525",14,"PE FDG SWRL DAIRY DSSRT",64,"OTHER"
"6526",14,"PE NEAPOLITAN DAIRY DSSRT",72,"OTHER"
"6527",14,"PE STRW DAIRY DESSERT",27,"OTHER"
"6528",14,"PE VANILLA DAIRY DESSERT",136,"OTHER"
"6529",14,"POPSICLE FIRECRACKER JR",145,"OTHER"
"6530",14,"POPSICLE FUDGSICLE NSA",247,"OTHER"
"6531",14,"POPSICLE OR/GR/CHRY",259,"OTHER"
"6532",14,"POPSICLE S/F OR/CH/GR",365,"OTHER"
"6533",14,"POPSICLE SCRIBBLERS",98,"OTHER"
"6534",14,"POPSICLE SF ORG/CHRY/GRP",120,"OTHER"
"6535",14,"POPSICLE SF TROPICALS",146,"OTHER"
"6536",14,"PPSCLE REDS CHRY,RSP,STRW",101,"OTHER"
"6537",14,"RBYS RCKT DSSRT FRZ GLXY",35,"OTHER"
"6538",14,"RBYS RCKT DSSRT FRZ ORBT",73,"OTHER"
"6539",14,"RBYS RCKT DSSRT FRZ RCK",56,"OTHER"
"6540",14,"REESE'S ICE CREAM CUP",108,"OTHER"
"6541",14,"RICE DREAM BITES VAN",10,"OTHER"
"6542",14,"RICE DREAM VAN",17,"OTHER"
"6543",14,"S.COW CHOC.VAN SANDWICH",140,"OTHER"
"6544",14,"S/COW NSA VANILLA SANDWICH",92,"OTHER"
"6545",14,"SCOOPS BANANA NUT",68,"OTHER"
"6546",14,"SCOOPS BUTTER PECAN",69,"OTHER"
"6547",14,"SCOOPS CHOCOLATE",187,"OTHER"
"6548",14,"SCOOPS CHOCOLATE CHIP",59,"OTHER"
"6549",14,"SCOOPS COOKIES & CREAM",152,"OTHER"
"6550",14,"SCOOPS LOWFAT CHOCOLATE",14,"OTHER"
"6551",14,"SCOOPS LOWFAT VANILLA",40,"OTHER"
"6552",14,"SCOOPS MUDSLIDE COFFEE I/C",71,"OTHER"
"6553",14,"SCOOPS NEOPOLITAN",92,"OTHER"
"6554",14,"SCOOPS ROCKY ROAD",103,"OTHER"
"6555",14,"SCOOPS STRAWBERRY",66,"OTHER"
"6556",14,"SCOOPS TSTD ALMOND FUDGE",117,"OTHER"
"6557",14,"SCOOPS VANILLA",621,"OTHER"
"6558",14,"SCOOPS VANILLA FUDGE",90,"OTHER"
"6559",14,"SK ICE CRM SAND LF VAN",101,"OTHER"
"6560",14,"SKINNY COW COOKIES & CRM",101,"OTHER"
"6561",14,"SKINNY COW FUDGE BAR",85,"OTHER"
"6562",14,"SLIM A BEAR 100CAL VAN BAR",202,"OTHER"
"6563",14,"SLIM ABEAR 100CA TOFF/FRVAN",12,"OTHER"
"6564",14,"SNICKERS ICE CRM BARS",174,"OTHER"
"6565",14,"SO BLISS FRZR POP 4PK CRRT AP",3,"OTHER"
"6566",14,"SO BLISS FRZR POP 4PK HIBISCUS",12,"OTHER"
"6567",14,"SO BLISS FRZR POP 4PK MANGO",4,"OTHER"
"6568",14,"SO BLISS FRZR POP 4PK SWT TEA",4,"OTHER"
"6569",14,"SO BLISS FRZR POP 4PK WTRMLN",36,"OTHER"
"6570",14,"SO DEL BAR CNUT ICRM ALM",28,"OTHER"
"6571",14,"SO DEL CNUT BAN SPLT MINI SNDW",20,"OTHER"
"6572",14,"SO DEL COCNT CHOC ICRM",34,"OTHER"
"6573",14,"SO DEL COCONT CKY DGH",55,"OTHER"
"6574",14,"SO DEL COCONT MLK ICRM",20,"OTHER"
"6575",14,"SO DEL COCONT MOCHA",35,"OTHER"
"6576",14,"SO DEL COCONT VAN",55,"OTHER"
"6577",14,"SO DELICIO SYICRM MIN SAN VAN",35,"OTHER"
"6578",14,"SOY DELC CHOC OBESSN OG2",15,"OTHER"
"6579",14,"STEVE DESSERT BANANA PUDDING",29,"OTHER"
"6580",14,"STEVE DESSERT BRBN VANILLA",29,"OTHER"
"6581",14,"STEVE DESSERT DRKLN BLKOUT",7,"OTHER"
"6582",14,"STEVE DESSERT SALTY CRML",8,"OTHER"
"6583",14,"STEVE ICE CRM BURNT SGR VNLLA",4,"OTHER"
"6584",14,"STEVE ICE CRM DRK CHOC SLTY CRML",7,"OTHER"
"6585",14,"STNYFLD FRZN YOG DRK CHOC",12,"OTHER"
"6586",14,"STNYFLD LF MNT CHO YGRT OG2",4,"OTHER"
"6587",14,"STNYFLD NF VAN FDG YGRT OG2",16,"OTHER"
"6588",14,"STNYFLD NF VAN YOGRT OG2",41,"OTHER"
"6589",14,"SWT FRDM VAN ICRM CONE",34,"OTHER"
"6590",14,"SYDRM BTR PCAN DSERT",12,"OTHER"
"6591",14,"TALENTI BLOOD ORANGE SORBETTO",20,"OTHER"
"6592",14,"TALENTI DBL DARK CHOC POP",24,"OTHER"
"6593",14,"TALENTI GEL FUDGE BROWNIE",100,"OTHER"
"6594",14,"TALENTI GELATO CARIBBEAN COCONUT",92,"OTHER"
"6595",14,"TALENTI GELATO CH/PNT BTR CUP",94,"OTHER"
"6596",14,"TALENTI GELATO CRML CKIE CRNCH",1476,"OTHER"
"6597",14,"TALENTI GELATO DBE DRK CHOC",91,"OTHER"
"6598",14,"TALENTI GELATO DBL DRK CHOC",273,"OTHER"
"6599",14,"TALENTI GELATO MILK CHOC",288,"OTHER"
"6600",14,"TALENTI GELATO PISTACHIO",170,"OTHER"
"6601",14,"TALENTI GELATO POP MDTRRNEAN MINT",10,"OTHER"
"6602",14,"TALENTI GELATO POP VAN",5,"OTHER"
"6603",14,"TALENTI GELATO ROMAN RASP SORBETTO",404,"OTHER"
"6604",14,"TALENTI GELATO SEA SALT",146,"OTHER"
"6605",14,"TALENTI GELATO VANILLA BEAN",152,"OTHER"
"6606",14,"TAMPICO TWIN POPS 3 FLVRS",46,"OTHER"
"6607",14,"TCBY FYOG COOKIES N CREAM",56,"OTHER"
"6608",14,"TCBY FYOG DBL CHOC CHNK",81,"OTHER"
"6609",14,"TCBY FYOG DBL CLS VAN BEAN",81,"OTHER"
"6610",14,"TCBY FYOG MINT CHOC CHIP",56,"OTHER"
"6611",14,"TCBY FYOG SLTD CRML SWIRL",92,"OTHER"
"6612",14,"TILLAMK ESPRESSO MOCHA ICRM",133,"OTHER"
"6613",14,"TILLAMK MUDSLIDE ICRM",264,"OTHER"
"6614",14,"TILLAMK OREGON STRW ICRM",113,"OTHER"
"6615",14,"TILLAMK ROCKY ROAD ICRM",116,"OTHER"
"6616",14,"TILLAMK VAN BEAN ICECREAM",601,"OTHER"
"6617",14,"TILLAMK VAN CHOC CHIP ICREAM",408,"OTHER"
"6618",14,"TILLAMOOK OR BLBRY PTCH ICRM",50,"OTHER"
"6619",14,"TILLAMOOK OREGON BLK CHRY",112,"OTHER"
"6620",14,"TILLMK CINN HORCHATA ICREAM",129,"OTHER"
"6621",14,"TILLMK CKIES N CRM ICREAM",148,"OTHER"
"6622",14,"TILLMK CRML BTR PCN ICREAM",233,"OTHER"
"6623",14,"TILLMK DUTCH CHOC ICREAM",245,"OTHER"
"6624",14,"TILLMK FIRESD SMORES ICREAM",110,"OTHER"
"6625",14,"TILLMK MARIONBRY PIE ICREAM",63,"OTHER"
"6626",14,"TILLMK MNT CHOC CHIP ICREAM",146,"OTHER"
"6627",14,"TILLMK OLD FASH VAN ICREAM",759,"OTHER"
"6628",14,"TILLMK TOFFEE CRNCH ICRM",174,"OTHER"
"6629",14,"TLNTI GEL BLK RSP CHC CHP",76,"OTHER"
"6630",14,"TOFUTTI CUTIES VANILLA",10,"OTHER"
"6631",14,"WHITE TOQUE BLINIS FRENCH 16PC",4,"OTHER"
"6632",14,"WINKS FROZEN CAKE BATTER",37,"OTHER"
"6633",14,"WINKS FROZEN CHOC MINT",21,"OTHER"
"6634",14,"WINKS FROZEN CINNAMON BUN",40,"OTHER"
"6635",14,"WINKS FROZEN COCOA DOUGH",25,"OTHER"
"6636",14,"WINKS FROZEN ICED LATTE",9,"OTHER"
"6637",14,"WONKA PUSH UP 9 CT BOX",76,"OTHER"
"6638",14,"WW CANDY BARS 6/2 FL OZ",140,"OTHER"
"6639",14,"WW CHOC SMTH BARS",65,"OTHER"
"6640",14,"WW CKIES&CRM BARS",106,"OTHER"
"6641",14,"WW DIVINE TRIPLE CHOCOLATE BARS",140,"OTHER"
"6642",14,"WW DRK CHC DULCE DE LECHE",81,"OTHER"
"6643",14,"WW DRK CHOC RSPB BARS",138,"OTHER"
"6644",14,"WW ENGLSH TFEE CRCH BAR",278,"OTHER"
"6645",14,"WW GIANT CHOC FUDGE BAR",163,"OTHER"
"6646",14,"WW GIANT LATTE BAR",108,"OTHER"
"6647",14,"WW SLTD CRML ICECRM BAR",205,"OTHER"
"6648",14,"WW SNACK SIZE VAN FUDGE SWRL CONES",123,"OTHER"
"6649",14,"WW SNK SZ CHOC FDG BARS",136,"OTHER"
"6650",14,"WW SNK SZ VP ICE CRM SNDWCH",63,"OTHER"
"6651",14,"WW STRW SMOOTHIE BARS",100,"OTHER"
"6652",14,"WW VAN RND ICE CRM SNDWCH",246,"OTHER"
"6653",15,"*CV*DIPPIN DOTS BAN SPLIT",59,"OTHER"
"6654",15,"*CV*DIPPIN DOTS BIRTHDAY CAKE",6,"OTHER"
"6655",15,"*CV*DIPPIN DOTS CHOC",41,"OTHER"
"6656",15,"*CV*DIPPIN DOTS CKIE DGH",18,"OTHER"
"6657",15,"*CV*DIPPIN DOTS CKIES/CRM",63,"OTHER"
"6658",15,"*CV*DIPPIN DOTS ICE RNBW",42,"OTHER"
"6659",15,"*CV*DIPPIN DOTS MINT CHOC",39,"OTHER"
"6660",15,"*CV*DIPPIN DOTS VAN ICE CRM",37,"OTHER"
"6661",15,"*D*BB SWT FRDM NSA FUDGE BAR 12CT",69,"OTHER"
"6662",15,"*D*BR CHOC FUDGE ICRM",62,"OTHER"
"6663",15,"*D*CHRSTMS ICE CRM EGGNG",9,"OTHER"
"6664",15,"*D*CHRSTMS MLK ICE CRM EGGNG",15,"OTHER"
"6665",15,"*D*XMAS EGGNG CHOC SWRL",7,"OTHER"
"6666",15,"*D*XMAS MLK I CRM EGGNOG SEASLT CRM",8,"OTHER"
"6667",15,"*D*XMAS MLK ICE CRM EGGNG FR VAN",9,"OTHER"
"6668",15,"*R* DREYERS FRT BAR LIME",78,"OTHER"
"6669",15,"*R* HD DULCE DE LECHE CARAMEL",42,"OTHER"
"6670",15,"*S*KEMP'S CANDY CANE ICECREAM",5,"OTHER"
"6671",15,"*S*KEMP'S CINNAMON ICECREAM",72,"OTHER"
"6672",15,"*S*TLNT EGG NG GLT",92,"OTHER"
"6673",15,"*S*TLNT PPPRMNT BRK GLT",82,"OTHER"
"6674",15,"*Z*BB FNWCH CKIES N CRM966620",34,"OTHER"
"6675",15,"*Z*BB FNWCH VN CH CHIP966619",28,"OTHER"
"6676",15,"*Z*BB SWT FRDM FDG LT 800134",10,"OTHER"
"6677",15,"ALDENS IC SALTED CARAMEL",8,"OTHER"
"6678",15,"ALDENS ICE CREAM CHOC CHP",12,"OTHER"
"6679",15,"ALDENS ICE CREAM CKIE CRM",11,"OTHER"
"6680",15,"ALDENS ICE CREAM VANILLA",65,"OTHER"
"6681",15,"ALDENS ICRM MINT CHIP OG2",18,"OTHER"
"6682",15,"ALMOND DREAM CAPP SWIRL",19,"OTHER"
"6683",15,"ALMOND DREAM CHOC",28,"OTHER"
"6684",15,"ALMOND DREAM CHOC BITES",25,"OTHER"
"6685",15,"ALMOND DREAM PRLN CRNCH",50,"OTHER"
"6686",15,"ALMOND DREAM VNLA",33,"OTHER"
"6687",15,"ALMOND DREAM VNLA BITE",25,"OTHER"
"6688",15,"ARTIC ZERO ICE CRM BUTTERY PECAN",13,"OTHER"
"6689",15,"ARTIC ZERO ICE CRM CHOC PNUT BTR",65,"OTHER"
"6690",15,"ARTIC ZERO ICE CRM COOKIE N CRM",44,"OTHER"
"6691",15,"ARTIC ZERO ICE CRM COOL MINT CHIP",18,"OTHER"
"6692",15,"ARTIC ZERO ICE CRM LIL BIT CHIPPY",15,"OTHER"
"6693",15,"ARTIC ZERO ICE CRM SEA SLT CRMEL",22,"OTHER"
"6694",15,"ARTIC ZERO ICE CRM VANILLA",28,"OTHER"
"6695",15,"ARTIC ZERO ICE CRMCOOKIE DOUGH CHIP",30,"OTHER"
"6696",15,"B BUNNY MINI SWRL VAN CONES",159,"OTHER"
"6697",15,"B&J BAN P/BTR GRK YOG",62,"OTHER"
"6698",15,"B&J BLBRY VAN GRHM GRK YOG",53,"OTHER"
"6699",15,"B&J CHEESECAKE BROWNIE",100,"OTHER"
"6700",15,"B&J CHERRY GARCIA",197,"OTHER"
"6701",15,"B&J CHERRY GARCIA CUP",296,"OTHER"
"6702",15,"B&J CHOC FDG BROWNIE",294,"OTHER"
"6703",15,"B&J CHOC FDG BROWNIE CUP",271,"OTHER"
"6704",15,"B&J CHOCC CHP COOKIE DOUGH",274,"OTHER"
"6705",15,"B&J CHUNKY MONKEY",64,"OTHER"
"6706",15,"B&J CINNAMON BUNS",103,"OTHER"
"6707",15,"B&J COFFEE BUZZ",90,"OTHER"
"6708",15,"B&J COFFEE W/HEATH",93,"OTHER"
"6709",15,"B&J COOKIE DOUGH CUP",281,"OTHER"
"6710",15,"B&J FY CHERRY GARCIA",166,"OTHER"
"6711",15,"B&J KARAMEL SUTRA",92,"OTHER"
"6712",15,"B&J MILK & COOKIES",232,"OTHER"
"6713",15,"B&J NEW YORK SUPER FUDGE",95,"OTHER"
"6714",15,"B&J PEANUT BUTTER CUP",54,"OTHER"
"6715",15,"B&J PHISH FOOD PT",164,"OTHER"
"6716",15,"B&J PNT BTTH CK CR",45,"OTHER"
"6717",15,"B&J PNT BTTR FUDGE CORE",110,"OTHER"
"6718",15,"B&J RASP FDG CHNK GRK YOG",19,"OTHER"
"6719",15,"B&J RED VELVET CAKE ICE CRM",52,"OTHER"
"6720",15,"B&J SLTD CARAMEL CORE",85,"OTHER"
"6721",15,"B&J STPHN COLBRT AMRICNE DREAM",240,"OTHER"
"6722",15,"B&J STRW SHRCK GRK YOG",16,"OTHER"
"6723",15,"B&J THE TONITE DGH",356,"OTHER"
"6724",15,"B&J VANILLA",131,"OTHER"
"6725",15,"B/BNY SWT FREEDOM VAN SNK SZ CONES",67,"OTHER"
"6726",15,"BASKIN ROBBIN VANILLA",125,"OTHER"
"6727",15,"BASKIN ROBIN CHOC ICECREAM",162,"OTHER"
"6728",15,"BB BDAY PARTY SNDWCH",32,"OTHER"
"6729",15,"BB BORDEAUX CHRY CHOC",254,"OTHER"
"6730",15,"BB CHAMP VAR PK CONES",64,"OTHER"
"6731",15,"BB CHOC LOVERS ICRM SNDWCH",78,"OTHER"
"6732",15,"BB MINI SWIRL CONE CHOC",83,"OTHER"
"6733",15,"BB MINI SWIRL CRML CONES",99,"OTHER"
"6734",15,"BB MINI SWRL BDAY PRTY CONE",69,"OTHER"
"6735",15,"BB PREM BUNNY TRACKS",452,"OTHER"
"6736",15,"BB PREM BUTTER PECAN",415,"OTHER"
"6737",15,"BB PREM CHUNKY CHOC CHIP",227,"OTHER"
"6738",15,"BB PREM COOKIES N CREAM",525,"OTHER"
"6739",15,"BB PREM DBL STRWBRY",248,"OTHER"
"6740",15,"BB PREM HOMEMADE CHOC",497,"OTHER"
"6741",15,"BB PREM HOMEMADE VAN",1496,"OTHER"
"6742",15,"BB PREM MINT CHOC CHIP",401,"OTHER"
"6743",15,"BB PREM NEAPOLITAN",258,"OTHER"
"6744",15,"BB PREM PNUT BTTR PANIC",373,"OTHER"
"6745",15,"BB PREM ROCKY ROAD",290,"OTHER"
"6746",15,"BB PREM TSTD ALMND FUDGE",327,"OTHER"
"6747",15,"BB RNBOW SHERBET CUPS 12CT",100,"OTHER"
"6748",15,"BB SMPLY VAN SNCWCH",143,"OTHER"
"6749",15,"BB SWEET FREEDOM VAN",195,"OTHER"
"6750",15,"BB SWT FRDM BAN SPLIT",118,"OTHER"
"6751",15,"BB SWT FRDM BTR PECAN",144,"OTHER"
"6752",15,"BB SWT FRDM BUNNY TRACKS",142,"OTHER"
"6753",15,"BB SWT FRDM NSA FUDGE BAR",69,"OTHER"
"6754",15,"BB SWT FRDM VAN IC SNDWCH",158,"OTHER"
"6755",15,"BB TRPL DLGHT SNDWCH",101,"OTHER"
"6756",15,"BBNY CARAMEL KRUNCH BARS",66,"OTHER"
"6757",15,"BBNY CHAMP CONE VAN",90,"OTHER"
"6758",15,"BBNY FUDGE BARS",73,"OTHER"
"6759",15,"BBNY SF NSA VAN KRUNCH BAR",83,"OTHER"
"6760",15,"BBNY SWT FRDM NSA VAN BAR",110,"OTHER"
"6761",15,"BBUNNY PREM PIST ALMOND",193,"OTHER"
"6762",15,"BDGT SAVER SF TWIN POPS",57,"OTHER"
"6763",15,"BDGT SAVER TWN POPS BAN",101,"OTHER"
"6764",15,"BDGT SVR MONSTR CHOC FDGE",22,"OTHER"
"6765",15,"BJ SMORES",113,"OTHER"
"6766",15,"BL BUNNY PREM VAN BEAN",933,"OTHER"
"6767",15,"BL BUNNY VAN ICRM CUPS 12CT",205,"OTHER"
"6768",15,"BLUE BNNY SS SPCD PMPKN PIE",95,"OTHER"
"6769",15,"BLUE BUNNY BIG FUDGE BARS",121,"OTHER"
"6770",15,"BLUE BUNNY LIME SHERBET",114,"OTHER"
"6771",15,"BLUE BUNNY ORANGE DREAM BAR 2.25OZ",68,"OTHER"
"6772",15,"BLUE BUNNY ORANGE SHERBET",201,"OTHER"
"6773",15,"BLUE BUNNY ORIG BOMB POP",430,"OTHER"
"6774",15,"BLUE BUNNY PREM VAN",1190,"OTHER"
"6775",15,"BLUE BUNNY RAINBOW SHERBET",108,"OTHER"
"6776",15,"BLUE BUNNY RASPBERRY SHERBET",105,"OTHER"
"6777",15,"BLUEBUNNY SS CIN APPLE PIE",30,"OTHER"
"6778",15,"BLUEBUNNY SS PPRMNT STCK",79,"OTHER"
"6779",15,"BLUEBUNNY SS SPUMONI",68,"OTHER"
"6780",15,"BOMB POP HWN PNCH",74,"OTHER"
"6781",15,"BOMB POP WARHEADS POPS",110,"OTHER"
"6782",15,"BOMB POPS WATERMELON",67,"OTHER"
"6783",15,"BR BUTTER PECAN",180,"OTHER"
"6784",15,"BR CHOC CHIP CKIE DGH",224,"OTHER"
"6785",15,"BR CHOC CHIP ICRM",189,"OTHER"
"6786",15,"BR COOKIES N CREAM",125,"OTHER"
"6787",15,"BR GOLD MEDAL RIBBON",150,"OTHER"
"6788",15,"BR JAMOCA ALMND FUDGE",181,"OTHER"
"6789",15,"BR MINT CHOC CHIP ICRM",464,"OTHER"
"6790",15,"BR NUTTY COCONUT",134,"OTHER"
"6791",15,"BR PNUT BUTTER N CHOC",105,"OTHER"
"6792",15,"BR PRALINES N CREAM",246,"OTHER"
"6793",15,"BR ROCKY ROAD",145,"OTHER"
"6794",15,"BREYER NAT LT CRMY VANILLA",31,"OTHER"
"6795",15,"BREYER NTRL CHRY VANILLA",26,"OTHER"
"6796",15,"BREYER NTRL FRCH VAN",145,"OTHER"
"6797",15,"BREYER VANILLA ICE CREAM",218,"OTHER"
"6798",15,"BREYER WFL CONE W/HRSHY CHOC CHP",48,"OTHER"
"6799",15,"BREYERS BLASTS BDAY",36,"OTHER"
"6800",15,"BREYERS BLASTS CREAMSICLE",14,"OTHER"
"6801",15,"BREYERS CARB SMART CHOC",60,"OTHER"
"6802",15,"BREYERS CO B GS THIN MINTS",32,"OTHER"
"6803",15,"BREYERS CO BRAND M&MS",18,"OTHER"
"6804",15,"BREYERS FAT FREE CRMY VAN",32,"OTHER"
"6805",15,"BREYERS LACTOSE FREE VAN",83,"OTHER"
"6806",15,"BREYERS NAT ROCKY ROAD",29,"OTHER"
"6807",15,"BREYERS NAT STRAWBERRY",27,"OTHER"
"6808",15,"BREYERS NSA VANILLA",76,"OTHER"
"6809",15,"BREYERS NTRL CHOC",82,"OTHER"
"6810",15,"BREYERS SNICKERS IC CRM",43,"OTHER"
"6811",15,"BRYER SMRT CARB VAN I/C",78,"OTHER"
"6812",15,"BRYERS OREO CHOC CKIE&CRM",49,"OTHER"
"6813",15,"BRYR GELATO CAPP",13,"OTHER"
"6814",15,"BRYR GELATO MNT CHC",11,"OTHER"
"6815",15,"BRYRS CRBSMRT ALMD I/C BAR",66,"OTHER"
"6816",15,"BRYRS TIRAMISU GELATO",35,"OTHER"
"6817",15,"BRYRS TRPL CHOC GELATO",26,"OTHER"
"6818",15,"BRYRS VAN CRML GELATO",81,"OTHER"
"6819",15,"BUDGET SAVER TWIN POPS",180,"OTHER"
"6820",15,"CHOCO TACO",28,"OTHER"
"6821",15,"CLEMMYS IC TSTD ALMOND",4,"OTHER"
"6822",15,"COOLHAUS IC SNDWCH CHOC",8,"OTHER"
"6823",15,"COOLHAUS IC SNDWCH PNTBTR",15,"OTHER"
"6824",15,"COOLHAUS ICE CRM 3-BAR M CH",3,"OTHER"
"6825",15,"COOLHAUS ICE CRM BANA FSTR",37,"OTHER"
"6826",15,"COOLHAUS ICE CRM BLSMC",25,"OTHER"
"6827",15,"COOLHAUS ICE CRM CHOC MLTN",39,"OTHER"
"6828",15,"COOLHAUS ICE CRM DRTY MNT",30,"OTHER"
"6829",15,"COOLHAUS ICE CRM SLT CRML",21,"OTHER"
"6830",15,"COOLHAUS ICE CRM SNDWCH BC",17,"OTHER"
"6831",15,"COOLHAUS ICE CRM SNDWCH CS",29,"OTHER"
"6832",15,"COOLHAUS ICE CRM SNDWCH DCM",30,"OTHER"
"6833",15,"COOLHS ICECRM 3-BAR VMCH",11,"OTHER"
"6834",15,"COOLHS ICECRM SNDWH VN BN",38,"OTHER"
"6835",15,"DAIYA CHEESECAKE NEW YORK STYLE",1,"OTHER"
"6836",15,"DAN OIKO GRK FRZ YGRT CAF LATTE",23,"OTHER"
"6837",15,"DAN OIKOS GRK FRZ YGRT CHOC",45,"OTHER"
"6838",15,"DAN OIKOS GRK FRZN YGRT KEY LIME",3,"OTHER"
"6839",15,"DAN OIKOS GRK FRZN YGRT STRWBRY",35,"OTHER"
"6840",15,"DIANA BANABAS BABIES MLK CHOC",59,"OTHER"
"6841",15,"DIANA BANANAS BABIES DRK CHOC",58,"OTHER"
"6842",15,"DIANA BANANAS BABIES MLK CHOC W/PNUT",15,"OTHER"
"6843",15,"DIPPIN DOTS RED BERRY",9,"OTHER"
"6844",15,"DIVINO GELATO FLD BLK DIA PLUM",11,"OTHER"
"6845",15,"DIVINO GELATO FLD ROMAN KIWI",1,"OTHER"
"6846",15,"DIVINO SORBET FLD AMALFI LEMON",6,"OTHER"
"6847",15,"DIVINO SRBT FLD APULIAN PCH",22,"OTHER"
"6848",15,"DIVINO SRBT FLD CIACL TNGRN",6,"OTHER"
"6849",15,"DREYER POMEGRANATE BARS",113,"OTHER"
"6850",15,"DREYERS ASSORTED FRUIT BAR",134,"OTHER"
"6851",15,"DREYERS BUTTER PECAN IC",50,"OTHER"
"6852",15,"DREYERS CHOCOLATE",4,"OTHER"
"6853",15,"DREYERS FRN VANILLA ICRM",118,"OTHER"
"6854",15,"DREYERS FRT BAR COCONUT",130,"OTHER"
"6855",15,"DREYERS FRUIT BAR STRAW",179,"OTHER"
"6856",15,"DREYERS LIGHT CHOCOLATE",66,"OTHER"
"6857",15,"DREYERS LIMITED EDITION",71,"OTHER"
"6858",15,"DREYERS MINT CHOC CHIP",94,"OTHER"
"6859",15,"DREYERS NEAPOLITAN",58,"OTHER"
"6860",15,"DREYERS ROCKY ROAD ICRM",71,"OTHER"
"6861",15,"DREYERS VANILLA ICE CREAM",297,"OTHER"
"6862",15,"DRUMSTICK NESTLE CRUNCH DPED",207,"OTHER"
"6863",15,"DRUMSTICK VANILLA",85,"OTHER"
"6864",15,"DRYRD FRUIT BAR NSA VARIETY",187,"OTHER"
"6865",15,"F'REAL MILKSHAKE MINT CHOC CHIP 16Z",38,"OTHER"
"6866",15,"F'REAL MLKSHK PMPKN CHSCKE",30,"OTHER"
"6867",15,"FATBOY CRML PRTZL SUNDAE",27,"OTHER"
"6868",15,"FATBOY JR SNDW VAN ICRM",41,"OTHER"
"6869",15,"FATBOY SNDW KEY LIME ICRM",23,"OTHER"
"6870",15,"FATBOY SNDW VAN PREM ICRM",91,"OTHER"
"6871",15,"FREAL BL/RSP/POM SMOOTHIE",9,"OTHER"
"6872",15,"FREAL CAPPUCCINO COFFEE",9,"OTHER"
"6873",15,"FREAL FRZN CAPP COFFEE 16OZ",9,"OTHER"
"6874",15,"FREAL MALT MILKSHAKE",21,"OTHER"
"6875",15,"FREAL MANGO SMOOTHIE",2,"OTHER"
"6876",15,"FREAL MILKSHAKE CHOC",38,"OTHER"
"6877",15,"FREAL MILKSHAKE CHOC 16OZ",38,"OTHER"
"6878",15,"FREAL MILKSHAKE CHOC MLT 16OZ",21,"OTHER"
"6879",15,"FREAL MILKSHAKE CKIES N CRM",90,"OTHER"
"6880",15,"FREAL MILKSHAKE COOKIES N CRM 16OZ",90,"OTHER"
"6881",15,"FREAL MILKSHAKE MINT",38,"OTHER"
"6882",15,"FREAL MILKSHAKE REESES",37,"OTHER"
"6883",15,"FREAL MILKSHAKE REESES BTR CUP16OZ",37,"OTHER"
"6884",15,"FREAL MILKSHAKE STRW",10,"OTHER"
"6885",15,"FREAL MILKSHAKE STWBRY 16OZ",10,"OTHER"
"6886",15,"FREAL MILKSHAKE VAN",18,"OTHER"
"6887",15,"FREAL MILKSHAKE VAN 16OZ",18,"OTHER"
"6888",15,"FREAL SMOOTHIE BB RSP PMGRNTE 16OZ",9,"OTHER"
"6889",15,"FREAL SMOOTHIE MANGO 16OZ",2,"OTHER"
"6890",15,"FREAL SMOOTHIE STRW BNA 16OZ",20,"OTHER"
"6891",15,"FREAL STRW/BAN SMOOTHIE",20,"OTHER"
"6892",15,"FRTARE STRW,MXD BRY,MILK",30,"OTHER"
"6893",15,"FRUITTARE FRT MILK BANANA",42,"OTHER"
"6894",15,"FRUITTARE REAL FRT MANGO",58,"OTHER"
"6895",15,"GANDY I. CRM MOOSE TRACKS",107,"OTHER"
"6896",15,"GANDY I.CRM CARAMEL CARIBOU",86,"OTHER"
"6897",15,"GANDY I.CRM CHERRY VANILLA",61,"OTHER"
"6898",15,"GANDY I.CRM NEAPOLITAN",101,"OTHER"
"6899",15,"GANDY ICE CREAM STRWBRY",28,"OTHER"
"6900",15,"GANDY ICE CRM CHOCOLATE",97,"OTHER"
"6901",15,"GANDY ICE CRM VANILLA",413,"OTHER"
"6902",15,"GANDY PNT CHOC CHP CKIE DGH",9,"OTHER"
"6903",15,"GANDY SLIM & TRM VANILLA",44,"OTHER"
"6904",15,"GANDY'S PINT BTTR PCN IC",26,"OTHER"
"6905",15,"GANDY'S PINT CHOC IC",13,"OTHER"
"6906",15,"GANDY'S PINT CKIE CRM IC",28,"OTHER"
"6907",15,"GANDY'S PINT STRWBRY  IC",7,"OTHER"
"6908",15,"GANDY'S PINT VAN  IC",29,"OTHER"
"6909",15,"GANDYS VANILLA ICE CREAM 4QT",358,"OTHER"
"6910",15,"GDPOP BANANA CINN 11OZ",7,"OTHER"
"6911",15,"GDPOP CHOC MILK 11OZ",3,"OTHER"
"6912",15,"GDPOP COFFEE 11OZ",5,"OTHER"
"6913",15,"GDPOP HIBISCUS MINT 11OZ",2,"OTHER"
"6914",15,"GDPOP STRWBRRY LMNADE 11OZ",4,"OTHER"
"6915",15,"GDPOP WTRMELN AGAVE 11OZ",9,"OTHER"
"6916",15,"GH POPSICLE SNOW CONE",59,"OTHER"
"6917",15,"GOOD HUMOR GIANT VAN SNDWCH",91,"OTHER"
"6918",15,"GOOD HUMOR KING CONE",21,"OTHER"
"6919",15,"GOOD HUMOR OREO COOKIE BAR",79,"OTHER"
"6920",15,"GOOD HUMOR STRWBRY SHRTCKE BAR",15,"OTHER"
"6921",15,"HAAGEN DAZ CUP CHOC PNUT BTTR",141,"OTHER"
"6922",15,"HAAGEN DAZ VAN YOGURT",11,"OTHER"
"6923",15,"HAAGEN DAZS BTR PECAN",126,"OTHER"
"6924",15,"HAAGEN DAZS CHOC ICE CREAM",117,"OTHER"
"6925",15,"HAAGEN DAZS CHOC PNUT BTTR",75,"OTHER"
"6926",15,"HAAGEN DAZS COFFEE IC",174,"OTHER"
"6927",15,"HAAGEN DAZS CUP CHOCOLATE",223,"OTHER"
"6928",15,"HAAGEN DAZS CUP COFFEE",285,"OTHER"
"6929",15,"HAAGEN DAZS CUP VANILLA",376,"OTHER"
"6930",15,"HAAGEN DAZS GELATO CUP SEA SLT CRML",71,"OTHER"
"6931",15,"HAAGEN DAZS GELATO DRK CHOC CHP",35,"OTHER"
"6932",15,"HAAGEN DAZS GELATO LIMONCELLO",26,"OTHER"
"6933",15,"HAAGEN DAZS GELATO SEA SALT CRML",52,"OTHER"
"6934",15,"HAAGEN DAZS GELATO STRACCIATELL",22,"OTHER"
"6935",15,"HAAGEN DAZS ROCKY ROAD",28,"OTHER"
"6936",15,"HAAGEN DAZS RUM RAISIN",51,"OTHER"
"6937",15,"HAAGEN-DAZ VAN BEAN",87,"OTHER"
"6938",15,"HAAGN DAZ GELATO CAPPUCCINO",28,"OTHER"
"6939",15,"HAG DAZ VANILLA",206,"OTHER"
"6940",15,"HAGEN DAZ CHOCOLATE",145,"OTHER"
"6941",15,"HAGEN DAZ COFFEE",179,"OTHER"
"6942",15,"HAGEN DAZ STWBRRY IC",172,"OTHER"
